"Crs Code","Name","Changed By","Changed Date","NLC","16 Char Name","Address Line 1","Address Line 2","Address Line 3","Address Line 4","Address Line 5","Postcode","Longitude","Latitude","Station Operator","Staffing Level","CCTV Available","Info. avail. from staff","Opening Note","CIS","Help Points","Help Points Available","Ticket Office Opening Note","Ticket Office Available","Ticket Office Location","Pre-purchase Collection","Ticket Machine Available","Oyster Issued","Oyster Topup","Oyster Pickup","Use Oyster","Oyster Comments","Smartcard Issued","Smartcard Topup","Smartcard Pickup","Smartcard Validator","Smartcard Comments","Travelcard Zone","Penalty Fares","Penalty Fares TOCs","Penalty Fares URL","Always show Oyster","Note","Primary Tel Country","Primary Tel Nr.","Primary Tel Ext.","Url","Available","Operator Name","Primary Tel Country","Primary Tel Nr.","Primary Tel Ext.","Url","Opening Note","Available","Operator Name","1st Class Lounge Note","1st Class Lounge Opening Note","1st Class Lounge Available","Seated Area Available","Seated Area Location","Waiting Room Opening Note","Waiting Room Available","Waiting Room Location","Trolleys Available","Refreshments Note","Refreshments Available","WC Available","WC Location","Baby Change Available","Baby Change Location","Showers Available","Telephones Exist","Telephones Usage Type","Wifi Note","Wifi Available","Web Kiosk Opening Note","Web Kiosk Available","Postbox Available","Postbox Location","Tourist Info Available","Tourist Info Location","ATM Available","ATM Location","Bureau de Change Available","Shops Note","Shops Available","Helpline Note","Helpline Contact","Helpline Opening Note","Staff Help Note","Staff Help Opening Note","Staff Help Available","Induction Loop","Accessible Ticket Machines Note","Accessible Ticket Machines Available","Height Adjusted Counter Note","Height Adjusted Counter Available","Train Access Ramp Available","Accessible Taxis","Accessible Phones","Nearest Stations More Facilities Note","National Key Toilets Available","National Key Toilets Location","Step Free Access Note","Step Free Access Available","Ticket Gates Note","Ticket Gates Available","Impaired Mobility Set Down Note","Impaired Mobility Set Down Available","Wheelchairs Opening Note","Wheelchairs Available","Spaces","Sheltered","Security","Location","Note","Type","Rail Replacement Note","Rail Replacement Map","Taxi Rank","Onward Travel","Metro Services","Airport","Port","Car Hire","Cycle Hire","Station Alert","TOCs","Station Category","Page Guid"
"BHM","Birmingham New Street","NClynes","07/03/2014",112700,"BIRMINGHAM N ST","New Street","Birmingham","West Midlands",,,"B2 4QA",-1.898360826,52.47819419,"NR","fullTime","Y","Yes - from help point, Yes - from information point, Yes - from ticket office",,"DepartureScreens, Announcements, ArrivalScreens","<p>Available at Customer Reception and station floorwalkers</p>","N",,"Y","<p>On the main concourse next to WH Smiths</p>","TicketMachine","Y","N","N","NotAvailable","N",,"N","N","NotAvailable","N",,,,,,"N","<p>Luggage received from terminated trains at Birmingham New Street only </p>",,"0121 632 6884",,"www.leftbaggage.co.uk/locations","Y","Excess Baggage Company",,"0121 632 6884",,"http://www.lostproperty.org/locations.php",,"Y","Excess Baggage Company","<p><strong>Located</strong></p> <p>On the paid concourse between Platforms 3 & 4 </p> <p><strong>Tickets Accepted</strong></p> <p>Virgin Business, First Open or Advance First tickets. You can only enter the lounge on the travel date shown on your ticket.</p> <p><strong>Facilities</strong></p> <p>Dedicated business areas are fully equipped with telephone points, desks, fax photocopier and modem facilities, screens with updated train information.</p> <p><strong>Refreshments</strong></p> <p>Tea, coffee, soft drinks.</p> <p><strong>Wi-Fi</strong></p> <p>Wi-Fi is available</p> <p><strong>Showers</strong></p> <p>No showers are available</p>",,"Y","N",,,"Y","There are two large seating areas beyond the ticket barrier between the escalators to platforms 5b and 8b. All platforms have waiting areas with seating","N","Food & drink available throughout the station","Y","Y","Men: between escalators to platforms 11b-12b. 30p Women: between escalators to platforms 11b-12b and between the escalators to 5a-6a (30p). Accessible: the men's and women's toilets have accessible cubicles. Free with Radar key or ask attendant Baby change: between escalators to platforms 11b-12b, free. The toilets between the escalators to 5a-6a have closed.","Y","Female toilets,Male toilets","N","Y","CardsAndCoins","<p><a href=""http://btopenzone.hotspot-directory.com/results.php?txtQuick=B2 4ND&amp;z=9&amp;radRoaming=1"" target=""_blank"">Find WiFi Hotspots around Birmingham New Street station</a></p>","Y",,"N","N","No post box within the station. On exiting the station at the Corner of Stephenson St / Navigation St (for Victoria Square) head towards Pinfold Street for the nearest post office 0.2miles Post Office 1 Pinfold Street Birmingham West Midlands B2 4AA","N",,"Y","ATM machines are located on the paid concourse","N","Boots located on the main concourse, before the ticket barrier Camden Food located beyond the ticket barrier Costa located beyond the ticket barrier next to Platform 5b escalator Funky Pigeon located beyond the ticket barrier between Platofrm escalators 9-10 M&S located on the main concourse Mi Casa Burritos located beyond the ticket barrier next to Platform 9 escalator Pasty Shop located beyond the ticket barrier next to Platform 7 escalator WHSmith located on the main concourse, before the ticket barrier","Y","<p>JourneyCare available at the station</p>",,,"<p>Go to the mobility assistance reception inside the Hill St entrance or call <strong>0121 654 4243</strong>.</p> <p>Alternatively call your train operator, ideally 24 hours in advance:</p> <ul> <li><a href=""http://www.arrivatrainswales.co.uk/Home.aspx"" title=""Arriva Trains Wales"" target=""_blank"" jQuery151023102426402967407=""202"">Arriva Trains Wales</a>- <strong>0845 300 3005</strong>, textphone <strong>0845 605 0600</strong>, Monday to Sunday 8:00 - 20:00 </li> <li><a href=""http://www.crosscountrytrains.co.uk/"" title=""Cross Country"" target=""_blank"" jQuery151023102426402967407=""203"">Cross Country</a>- <strong>0844 811 0125</strong>, textphone <strong>0844 811 0126</strong>,<strong></strong>Monday to Sunday 8:00 - 20:00 </li> <li><a href=""http://www.firstgreatwestern.co.uk/"" title=""First Great Western"" target=""_blank"" jQuery151023102426402967407=""204"">First Great Western</a>- <strong>0800 197 1329</strong>, textphone <strong>0800 294 9209</strong>, Monday to Friday 7:00 - 22:00, Saturday and Sunday 8:00 to 19:00</li> <li><a href=""http://www.londonmidland.com/"" title=""Midlands Trains/London Midland"" target=""_blank"" jQuery151023102426402967407=""205"">Midlands Trains / London Midland</a>- <strong>0800 092 4260</strong>, textphone <strong>0844 811 0134</strong>, Monday to Sunday 8:00 - 22:00 </li> <li><a href=""http://www.virgintrains.co.uk/"" title=""Virgin Trains"" target=""_blank"" jQuery151023102426402967407=""206"">Virgin Trains</a>- <strong>0845 744 3366</strong>, textphone <strong>0845 744 3367</strong>, Monday to Sunday 8:00 - 22:00</li> </ul>",,"Y","Y","<p>Staff available to assist where required.</p>","N","<p>Floorwalkers are available to assist all customers</p>","Y","Y","<p>Taxis drop off within the 'drop & go' off the Hill Street entrance.</p> <p>The taxi rank is on Navigation St (Stephenson St / Victoria Sq exit).</p> <p>All taxis are accessible with manual wheelchairs, most are accessible with electric wheelchairs.</p> <p>For more information visit <a href=""""http://www.traintaxi.co.uk/"""" title=""""traintaxi - the guide to taxis serving all train stations"""" target=""""_blank"""" jQuery15105487555210230162=""""201"""">traintaxi</a>.</p>","<p>Located opposite Network Rail recpetion on the main concourse</p>",,"N",,"<p>The footpath to the entrance from Hill St has steps, though there is level access from the drop off point.</p> <p>All platforms have lifts and escalators except 12b (follow the signs for 12a which has a lift) and 1 which has a lift and stairs only.</p>","Y",,,"<p>Assistance is available to and from platforms, though we can help more effectively if you call us in advance on 0121 654 2528 (Mon-Fri 10:00-18:00) or outside these times 0121 654 4243. Please contact customer services of the relevant train operator: London Midland 0845 602 4277. Virgin Trains - 0845 000 8000</p>","Y",,"Y",46,"Yes","Y","<p>Between Stephenson Street and the Moor Street Link Bridge</p>","<p>If you want to take your bicycle on the train, please check with the relevant train operator beforehand :-</p> <p><a href=""""http://www.arrivatrainswales.co.uk"""">http://www.arrivatrainswales.co.uk</a></p> <p><a href=""""http://www.crosscountrytrains.co.uk"""">http://www.crosscountrytrains.co.uk</a></p> <p><a href=""""http://www.firstgreatwestern.co.uk"""">http://www.firstgreatwestern.co.uk</a></p> <p><a href=""""http://www.londonmidland.com"""">http://www.londonmidland.com</a></p> <p><a href=""""http://www.virgintrains.co.uk"""">http://www.virgintrains.co.uk</a></p>","Stands",,,"<p>Taxis drop off with the 'drop & go' in the Hill Street entrance.</p> <p>The taxi rank is on Navigation St (Stephenson St / Victoria Sq exit).</p> <p>For more information visit <a href=""""http://www.traintaxi.co.uk/"""" title=""""traintaxi - the guide to taxis serving all train stations"""" target=""""_blank"""" jQuery15105487555210230162=""""201"""">traintaxi</a>.</p>","<p>There are nearby bus stops on Smallbrook Queensway and Hill Street</p> <p>Most buses are wheelchair accessible.</p> <p>For information go to the local travel information office by the Stephenson Street entrance or visit <a href=""""http://www.centro.org.uk/"""" title=""""Centro"""" target=""""_blank"""" jQuery15106307049966258862=""""200"""">Centro</a>, </p> <p><strong>0121 214 7214</strong>.</p>","<p>For details of the Midland Metro (tram network) visit: www.travelmetro.co.uk</p> <p> </p>","<p>Regular train service to Birmingham International. 10 - 15 minute journey</p>",,,,"<p><span><span lang=""EN""><strong>Cheltenham Festival 2014</strong></span></span></p> <p><span><span lang=""EN""><em><strong>Tuesday 11th March - Friday 14th March</strong></em></span></span></p> <p><span><span lang=""EN"">In the interest of safety, passengers heading to the Cheltenham Festival are required to join a queuing system.  This is to ensure passenger volumes are manged safely at Platform level.</span></span></p> <p><span><span lang=""EN""><strong>On arrival into the station please follow the signage arrows to the queuing system.</strong></span></span></p> <p><span><span lang=""EN""></span></span></p> <p><span><span lang=""EN"">On Sunday 28 April 2013, Network Rail reached the half way point of the project. There are three new entrances therefore you will need to allow a little extra time should you not be familiar with the new station.  </span></span></p> <p><span><span lang=""EN"">If your changing trains at New Street, please allow a 12 minute minimum connection time</span></span></p> <p><span><span lang=""EN"">For further information please visit <a href=""http://newstreetnewstart.co.uk/"" title=""http://newstreetnewstart.co.uk/"">newstreetnewstart.co.uk</a>.<o:p></o:p></span></span></p>","NR",,"DACDE40DBEA8483BA26E4F0CDA1190F3"
"EDB","Edinburgh","IMacdonald","19/01/2014",932800,"EDINBURGH.","Waverley Station","Edinburgh",,,,"EH1 1BB",-3.188221921,55.95238716,"NR","fullTime","Y",,,"DepartureScreens, Announcements, ArrivalScreens",,"N","Advanced Tickets can only be purchased between 09:30 and 18:30 Monday-Sunday.","Y","<p>In the Travel Centre </p> <p></p> <p></p> <p></p>","TicketOffice, TicketMachine","Y","N","N","NotAvailable","N",,"N","N","NotAvailable","N",,,,,,"N","<p>Available during Station Opening times please go to Network Rail reception opposite platform 2.</p>",,"0131 558 3829",,"http://www.left-baggage.co.uk/locations.php","Y","Excess Baggage Company",,,,"http://www.lostproperty.org/locations.php","Situated within left luggage.","Y","Excess Baggage Company","<p><strong>Opening Hours</strong></p> <p><em>East Coast:</em></p> <ul> <li>Mon-Fri 06:30-21:00 </li> <li>Sat 09:30-17:30</li> <li>Sun 09:30-19:00 </li> </ul> <p><em>ScotRail </em></p> <ul> <li>Mon-Fri 08:40-23:28 </li> <li>Sat Closed </li> <li>Sun 16:00-23:59</li> </ul> <p><strong>Located</strong></p> <p>Opposite platform 11</p> <p><strong>Tickets Accepted with ScotRail</strong></p> <p>All First Class.</p> <p>Advance Loyalty Club members can also use all ScotRail First Class Lounges on presentation of their membership card as well as ANY type of ticket valid for travel on ScotRail services that day. Tickets not valid on ScotRail services cannot be accepted</p> <p><strong>Tickets Accepted with East Coast</strong></p> <ul> <li>Fully inter-available First Class Season Ticket (ie tickets not specific to one train company)</li> <li>Any First Class Anytime ticket valid for travel on the East Coast route.</li> <li>Any East Coast First Class packages.</li> <li>Holders of a First Class Lounge supplement, available for purchase with a East Coast First Advance ticket or First Class reader offer.</li> </ul> <p><strong>Restricted tickets with East Coast</strong></p> <ul> <li>All First Advance tickets (unless accompanied by a <a href=""""http://www.nationalrail.co.uk/times_fares/promotions/prce44205e9a4730a3b6fe5973cdebbc/details.html"""">First Class Lounge Upgrade</a>) </li> <li>All tickets with Weekend First supplements. </li> <li>All First Class tickets valid only on other train operators, including ScotRail Sleepers</li> </ul> <p><strong>Facilities</strong></p> <p>Toilets/Fax/Printer/Meeting rooms, TV, newspapers, screens with updated train information, fax, telephone</p> <p><strong>Refreshments</strong></p> <p>Complimentary: tea/coffee/hot chocolate/orange juice/water/ biscuits</p> <p><strong>Wi-Fi</strong></p> <p>Yes</p> <p><strong>Showers</strong></p> <p>No</p>",,"Y","N",,,"Y",,"Y","Coffee shop Public House/Bar Food outlet (Seating available)","Y","Y",,"Y","Female toilets,Male toilets,","Y","Y","CardsAndCoins","&lt;p&gt;&lt;a href=&quot;&quot;http://btopenzone.hotspot-directory.com/results.php?txtQuick=EH1 1BB&amp;z=9&amp;radRoaming=1&quot;&quot; target=&quot;&quot;_blank&quot;&quot;&gt;Find WiFi Hotspots around Edinburgh Waverley station&lt;/a&gt;&lt;/p&gt;","Y",,"N","Y","Located on the concourse","N",,"Y","Located on concourse Located by the ticket office","Y","Wide range of shops Passport Photo Booth","Y",,,,"Available during Station Opening times",,"Y","Y","<p>All East Coast machines are DDA compliant in the Travel Centre</p>","Y","<p>No lowered counter</p>","N","Y","<p>Accessible taxi's operate from the taxi rank. </p>","<p>Available in part on the main concourse during Station Opening times</p>",,"Y","<p>At entrance to Public Toilets</p>","<p>Suitable for disabled passengers.  Level access to all platforms. </p>","Y","Automatic Ticket Gates operate at Platforms 12-18.","Y","<p>Assistance is available to and from platforms, though we can help more effectively if you call us in advance. Please contact customer services of the relevant train operator: East Coast &ndash; 08457 225 333. Virgin Trains &ndash; 0870 789 1234. ScotRail &ndash; 08456 015929</p>","Y",,"Y",74,"Yes","Y","Cycle Storage is available on Platform 3","Please do not leave&nbsp;panniers, bags or trailers attached to bicycles or racks.&nbsp;Panniers, bags or trailers attached to bicycles will be removed and&nbsp;deposited in&nbsp;lost property,&nbsp;a fee&nbsp;may be&nbsp;charged&nbsp;for their return.&nbsp;","Stands",,,"<p>The taxi rank is located adjacent to Platform 11 within the station and operates 04:00 - 0045 Monday-Saturday, 06:00 - 00:45 Sundays.</p>","<p>Lothian Buses provide a network of daily, frequent bus services around the city. For details: <a href=""http://www.lothianbuses.com"">www.lothianbuses.com</a></p> <p><br/></p> <p>Buy an Edinburgh PLUSBUS ticket with you train ticket, for unlimited bus travel around the whole of Edinburgh. For details: <a href=""http://www.plusbus.info"">www.plusbus.info</a></p>",,"<p>Daily, frequent 'Airlink 100' express shuttle bus, operated by Lothian Buses. For details: <a href=""http://www.lothianbuses.com"">www.lothianbuses.com</a>&nbsp;</p> <p>Through-tickets from National Rail stations to Edinburgh Airport are available via Edinburgh Waverley - ask for a ""EDINBURGH AIRPORT"" ticket (ticket code K671);</p>",,,,"<p>No Public Vehicle Access from 20 January 2014</p> <p>From Monday 20 January, no private vehicles will be permitted access. Only taxis with security clearance and an electronic permit will be able to proceed beyond the security measures. A number of dedicated disabled travel service vehicles will also be granted access.</p> <ul> <li>New drop off points are available on Calton Road and Market Street.</li> <li>30 Minutes free parking within New Street Car Park for drop off and pick up.</li> <li>All 5 entrances now have step free access.</li> </ul>","NR",,"4226138DBFD44B62A2EBE9B063FB340A"
"GLC","Glasgow Central","SPimperton","13/03/2014",981300,"GLASGOW CENTRAL","Gordon Street","Glasgow",,,,"G1 3SL",-4.257636004,55.85974143,"NR","fullTime","Y",,,,,"Y","Ticket Office (Scottish Destinations) Monday-Saturday 0545-2330 Sunday 0915-2130","Y","<p>High Level: In the Travel Centre</p> <p>Low level: Next to telephones at Ticket office</p>","TicketMachine","Y","N","N","NotAvailable","N",,"N","N","NotAvailable","N",,,,,,"N",,,"0141 221 8597",,"http://www.left-baggage.co.uk/locations.php","Y","Excess Baggage Company",,,,"http://www.lostproperty.org/locations.php",,"Y","Excess Baggage Company",,,"N","N",,,"Y",,"Y",,"Y","Y",,"Y",,"Y","Y","CardsAndCoins","&lt;p&gt;Find WiFi Hotspots around Glasgow Central station&lt;/p&gt;","Y",,"N","N","Located on the concourse","N",,"Y","Located on concourse","Y","Wide range of shops","Y",,,,,,"Y","Y",,"N","<p>Ticket Office: available</p> <p>Travel Centre: not available</p>","Y","Y",,,,"N",,,"Y",,,"<p>Meeting point at Gordon Street entrance outside Travel Centre.</p>","Y",,"Y",80,"Yes","Y",,"<p>Whilst station is open. Located on platform 15.</p>","Stands","<p>High level: Buses will pick up / drop off on Gordon Street.</p> <p>Low level: Buses will pick up / drop off on Argyle Street.</p>",,"<p>Taxis are available outside opposite the Gordon Street exit.</p>","<p>'First' operate a network of frequent local bus routes around Glasgow city and nearby towns. For route maps and timetables:</p> <p>www.firstgroup.com/ukbus <p> </p> <p>'Arriva' and 'Stagecoach' operate a network of routes from Glasgow to surrounding towns. For routes and times:</p> </p> <p>www.arrivabus.co.uk and www.stagecoachbus.com <p> </p> <p>Buy a Glasgow <em><strong>PLUSBUS</strong></em> ticket with your train ticket, for discount price unlimited bus travel around the city. For details:</p> </p> <p>www.plusbus.info</p> <p> </p> <p>For information about all public transport  in Glasgow and Strathclyde the area visit:</p> <p>www.spt.co.uk</p>",,"<p><strong>GLASGOW CITY AIRPORT</strong>:</p> <p> <p>Arriva operate the frequent, daily 'Glasgow Flyer 500' bus from Buchanan Street Bus Station direct to the airport. For times:<strong> </strong><strong>www.arrivabus.co.uk</strong><strong>  </strong></p> <p>First operate regular, daily 'Airlink' express 757 from Buchanan Street Bus Station direct to the airport. For times: <strong>www.firstgroup.com/ukbus</strong></p> </p> <p> </p>","<p>Service to Gourock for onward ferry connection to Dunoon and Kilcreggan. Service to Wemyss Bay for onward ferry connection to Rothesay. Service to Ardrossan Harbour for onward ferry connection to Brodick. Service to Stranraer for onward ferry connection to Belfast.</p>",,,,"NR",,"4AF6A7DF21C148ACB291007EF7D19699"
"LDS","Leeds","iwatson","25/02/2014",848700,"LEEDS.","Leeds","Leeds",,,,"LS1 4DY",-1.547435079,53.79489697,"NR","fullTime","Y",,,"DepartureScreens, Announcements, ArrivalScreens",,"N","The Travel Centre is open Monday - Saturday 09:00 - 18:00 and Sunday 10:00 - 17:00","Y","<p>South Concourse</p>","TicketMachine","Y","N","N","NotAvailable","N",,"N","N","NotAvailable","N",,,,,,"N",,,,,"http://www.left-baggage.co.uk/locations.php","Y","Excess Baggage Company",,,,"http://www.lostproperty.org/locations.php",,"Y","Excess Baggage Company","<p><strong>Location</strong></p> <p>In the Booking Hall</p> <p><strong>Tickets Accepted</strong></p> <ul> <li>Fully inter-available First Class Season Ticket (ie tickets not specific to one train company).</li> <li>Any First Class Anytime ticket valid for travel on the East Coast route.</li> <li>Any East Coast First Class packages.</li> <li>Holders of a First Class Lounge supplement, available for purchase with a East Coast First Advance ticket or First Class reader offer. </li> </ul> <p class=""""MsoNormal""""><strong>Restricted tickets</strong></p> <ul> <li>All First Advance tickets (unless accompanied by a <a href=""""http://www.nationalrail.co.uk/times_fares/promotions/prce44205e9a4730a3b6fe5973cdebbc/details.html"""">First Class Lounge Upgrade</a>) </li> <li>All tickets with Weekend First supplements. </li> <li>All First Class tickets valid only on other train operators, including ScotRail Sleepers.  </li> </ul> <p><strong>Facilities</strong></p> <p>Toilets/Fax/Printer, TV</p> <p><strong></strong></p> <p><strong>Refreshments</strong></p> <p>Complimentary: tea/coffee/hot chocolate/orange juice/water/ biscuits </p> <p><br/></p> <p><strong></strong></p> <p><strong>Wi-Fi</strong> </p> <p>Yes</p> <p><strong></strong></p> <p><strong>Showers </strong></p> <p>No</p> <p><br/></p> <p><br/></p> <p><br/></p>",,"Y","N",,,"Y",,"Y",,"Y","Y",,"Y",,"N","Y","CardsAndCoins","&lt;p&gt;&lt;a href=&quot;&quot;http://btopenzone.hotspot-directory.com/results.php?txtQuick=LS1 4DY&amp;z=9&amp;radRoaming=1&quot;&quot; target=&quot;&quot;_blank&quot;&quot;&gt;Find WiFi Hotspots around Leeds station&lt;/a&gt;&lt;/p&gt;","Y",,"N","Y",,"Y",,"Y",,"N",,"Y",,,,,,"Y","Y","<p>There are 11 East Coast accessible Ticket Machines.</p>","Y","This is a test to check if red dot also publishes station page","Y","Y","<p>taxi rank outside main station entrance</p>","<p>main concourse</p>",,"N",,"<p>Suitable for disabled passengers. Lifts or Level access to all platforms. </p>","Y",,,"<p>Assistance is available to and from platforms. Please contact customer services of the appropriate train operator, 48 hours in advance:  East Coast - 08457 225 225. East Midlands Trains - 08457 125 678. First TransPennine Express - 0800 107 2149. Northern Rail - 0870 6023322. Virgin Trains - 08457 443 366.</p>","Y",,"Y",436,"Yes","Y","Platform 1 and Taxi rank under cover. Short stay car park not under cover.","<p>There are free to use Cycle Racks on Platform 1 and in the short stay parking area at the rear of the station.</p> <p><span style=""mso-fareast-font-family: calibri; mso-fareast-theme-font: minor-latin; mso-ansi-language: en-gb; mso-fareast-language: en-gb; mso-bidi-language: ar-sa;"">Leeds CyclePoint has 300 secure spaces at £1 a day. The facility is open 07:00-19:00 weekdays and 10:00-1800 at weekends.</span></p> <p><span style=""mso-fareast-font-family: calibri; mso-fareast-theme-font: minor-latin; mso-ansi-language: en-gb; mso-fareast-language: en-gb; mso-bidi-language: ar-sa;"">Cycling is not permitted on the concourse or platforms.</span></p>","Stands",,,"<p>Taxi rank outside station entrance by bus interchange.</p>","<p>'Arriva' and 'First' both operate a network of frequent local bus routes around Leeds city and west Yorkshire . For route maps and timetables: www.arrivabus.co.uk and www.firstgroup.com/ukbus</p> <p>Buy a Leeds <em><strong>PLUSBUS</strong></em> ticket with your train ticket, for discount price unlimited bus travel around the city. For details: www.plusbus.info</p> <p>Many bus routes serve bus stops on New Station Street in front of the rail station.</p> <p>The Leeds CityBus service, linking various locations in Leeds city centre, departs from stand S8 in front of Leeds station at frequent intervals. The service runs Mondays to Saturdays between 06:30 and 19:30. A flat fare of 50p is charged.</p> <p>For information about all buses in west Yorkshire visit: www.wymetro.com</p>",,"<p>'First' operate '<strong>Airlink'</strong> 757 every 30 minutes during day and 60 minutes at night from the station forecourt direct to Leeds Bradford Airport terminal.</p> <p>For details: www.firstgroup.com/ukbus</p>",,,"<p><span style=""mso-fareast-font-family: calibri; mso-fareast-theme-font: minor-latin; mso-ansi-language: en-gb; mso-fareast-language: en-gb; mso-bidi-language: ar-sa;"">F W Evans(Cyclepoint)<br /> <a href=""mailto:leedscp.store@evanscycles.com""><span>leedscp.store@evanscycles.com</span></a><br /> 0113 245 4739</span></p>",,"NR",,"3873C992A8184B11B30B15FA8099366E"
