"ECR","East Croydon","kmonk","18/03/2014",535500,"EAST CROYDON","George Street","Croydon",,,,"CR0 1LF",-0.092276539,51.37500564,"SN","fullTime","Y",,,"DepartureScreens, Announcements, ArrivalScreens","<p>Help/info points on platforms. Also Customer help desks on all platforms.</p>","Y",,"Y","<p>Located in the booking hall</p>","TicketMachine","Y","Y","Y","TicketMachine","Y",,"N","N","NotAvailable","N",,"Zone 5",,,,"Y","<p>Please call Customer services on 08451 272 920</p>",,,,,"N",,,,,,,"N","Please call Customer services on 08451 272 920",,,"N","Y",,,"Y",,"Y","Coffee shop Coffee kiosk Food outlet (Seating available)","Y","Y",,"Y","Female toilets","N","N",,"&lt;p&gt;&lt;a href=&quot;&quot;http://btopenzone.hotspot-directory.com/results.php?txtQuick=CR0 1LF&amp;z=9&amp;radRoaming=1&quot;&quot; target=&quot;&quot;_blank&quot;&quot;&gt;Find WiFi Hotspots around East Croydon station&lt;/a&gt;&lt;/p&gt;","Y",,"N","N",,"N",,"Y","Located outside the station","N","Shoe repairer Wide range of shops Off Licence Passport Photo Booth","Y","<p>Please call the Assisted travel team on 0800 138 1016</p>","Please call the Assisted travel team on 0800 138 1016",,,,"Y","Y","<p>Located on concourse , and outside of station .</p>","Y",,"Y","Y",,,,"N","<p>Radar key</p>","<p>Long steep ramps to platforms from main entrance.  Lifts to all platforms from Landsdowne Road entrance or interchange between platforms.</p>","Y",,,,"Y",,"Y",62,"Yes","Y","station front, opposite Platform 6",,"Stands","<p>Existing bus stop E8 in Dingwall Road (06.00 - 00.00) or East Croydon Bus Station (00.00 - 06.00).</p>",,"<p>Information on taxis from this station is available at <a href=""""http://www.traintaxi.co.uk"""">www.traintaxi.co.uk</a></p> <p>Black cabs outside station</p>","<p>Information to plan your onward journey is available in a printable format <a href=""""http://www.nationalrail.co.uk/posters/ECR.pdf"""">here</a></p>","<p>Tramlink</p>",,,,,"<p>Step free access is available via ramps to all platforms and lifts to platforms 1,2,3 &amp; 4.  However, due to the severe weather and water ingress, the lift on platforms 5/6 are out of use until further notice.  To book assistance please call Southern Assisted Travel on 0800 138 1016.  </p>","SN",,"69E322AF14AF44ADA527F98EC7453973"
"EDW","East Dulwich","CPancutt","18/11/2013",535800,"EAST DULWICH","Grove Vale","East Dulwich","London",,,"SE22 8EF",-0.080717696,51.46132011,"SN","fullTime","Y",,,"Announcements, ArrivalScreens","<p>White in colour can be located on both platforms.</p>","Y",,"Y","<p>Located in the booking hall</p>","TicketMachine","Y","N","Y","TicketMachine","Y",0,"N","N","NotAvailable","N",,"Zone 2",,,,"Y",,,,,,"N",,,,,,,"N",,,,"N","Y",,,"N",,"N",,"N","N",,"N",,"N","Y","CardsAndCoins","&lt;p&gt;&lt;a href=&quot;&quot;http://btopenzone.hotspot-directory.com/results.php?txtQuick=SE22 8EF&amp;z=9&amp;radRoaming=1&quot;&quot; target=&quot;&quot;_blank&quot;&quot;&gt;Find WiFi Hotspots around East Dulwich station&lt;/a&gt;&lt;/p&gt;","N",,"N","N",,"N",,"N",,"N",,"N",,,,,,"Y","Y","<p>Quickfare machines can be located by entrance to platform 1</p>","Y",,"Y","Y","<p>For information contact local taxi companies, details of which can be found at www.traintaxi.co.uk.</p>",,,"N",,"<p>Steep ramp to Platform 1 (to London Bridge).  Steps and steep ramp to Platform 2 (to Tulse Hill).</p>","Y",,,,"N",,"N",6,"Yes","Y","By entrance to platform 1 .",,"Lockers","<p>Down from station at existing bus stops on East Dulwich Grove.</p>",,"<p>Information on taxis from this station is available at www.traintaxi.co.uk</p>","<p>Information to plan your onward journey is available in a printable format <a href=""""http://www.nationalrail.co.uk/posters/EDW.pdf"""">here</a></p>",,,,,,,"SN",,"43F898CAFDAE4479BA7454E2289A757B"
"EGR","East Grinstead","CRaan","21/03/2014",548600,"EAST GRINSTEAD","Railway Approach","East Grinstead","West Sussex",,,"RH19 1EB",-0.017895018,51.12626697,"SN","fullTime","Y",,,"Announcements, ArrivalScreens","<p>Located in the station car park. </p>","Y",,"Y","<p>Located in the booking hall</p>","TicketMachine","Y","N","N","NotAvailable","N",,"N","Y","TicketMachine","Y","<p>Southern's smartcard is called 'the key'.  To apply online, please go to <a href=""http://www.southernrailway.com/thekey"">www.southernrailway.com/thekey</a> or pick up an application form from a Southern ticket office. </p>",,"Applicable Operators: Southern","SN",,"N","<p>Customer Services 08451 272920</p>",,,,,"N",,,,,,,"N",,,,"N","Y",,,"N","<p>There is coffee shop seating in booking hall, whilst there are also bench style seating in the platform waiting shelters</p>","N","Coffee kiosk","Y","Y","<p>Male / Female and accessible toilets can be located in the booking hall, next to the automatic ticket gates</p>","Y",,"N","N",,"&lt;p&gt;&lt;a href=&quot;&quot;http://btopenzone.hotspot-directory.com/results.php?txtQuick=RH19 1EB&amp;z=9&amp;radRoaming=1&quot;&quot; target=&quot;&quot;_blank&quot;&quot;&gt;Find WiFi Hotspots around East Grinstead station&lt;/a&gt;&lt;/p&gt;","N",,"N","N",,"N",,"Y",,"N",,"Y",,,,,,"Y","Y","<p>Located in the booking hall.</p>","Y",,"Y","Y","<p>There are no accessible taxis at this station, they must be booked.</p> <p>For information contact local taxi companies, details of which can be found at www.traintaxi.co.uk.</p>",,"<p>Oxted</p>","Y","<p>Located with Male & Female toilets by the ticket barriers</p>","<p>Step free access to platform 2 (to/from Victoria) only. Footbridge with steps to platform 1 (occasionally to/from Victoria). Interchange between platforms is possible via country end crossing boards for manual wheelchair users with staff assistance only. Nearest step-free station is Hurst Green.</p> <p><span>There are only a few trains daily that <strong>depart </strong>from Platform 1 (not step free).  In the current timetable these are: Monday to Friday: 05.58 to Victoria, 06.49 & 07.19 to London Bridge, 10.07 & 15.07 to Victoria.  22.37 Fridays only to Victoria.   On Saturdays only the 07.07 to Victoria.  All other trains are scheduled to depart from Platform 2 which has direct step free access.</span></p> <p><span>Trains <strong>arriving </strong>from Victoria onto Platform 1 are 08.53 (arr 09.48) and 13.53 (arr 14.47) during week days only.  On Fridays only the 21.23 (arr 22.17) and on Sundays only the 22.36 (arr 23.34).</span></p>","N",,,"<p>Located in the car park.  </p>","Y",,"Y",40,"No","Y","Located to the right of the station building.",,"Stands","<p>Station forecourt.</p>",,"<p>Information on taxis from this station is available at www.traintaxi.co.uk</p>","<p>Information to plan your onward journey is available in a printable format <a href=""""http://www.nationalrail.co.uk/posters/EGR.pdf"""">here</a></p>",,,,,,"<p>&#160;</p> <p><strong></strong></p> <span><span><span><span> <p><span>There are only a few trains daily that <strong>depart </strong>from Platform 1 (not step free).&#160; In the current timetable these are: Monday to Friday: 05.45, 06.49 &amp; 07.19 to London Bridge, 10.07 &amp;&#160;15.07&#160;to Victoria.&#160; On Sunday only the 09.42 to Victoria.&#160; All other trains are scheduled to depart from Platform 2 which has direct step free access.</span></p> <p><span>Trains <strong>arriving</strong> from Victoria onto Platform 1 are 08.53 (arr 09.48)&#160;and 13.53 (arr 14.47)&#160;during week days only.&#160; On Saturdays only the 22.53 from Victoria arriving at 23.47 and on Sundays only the 22.36 (arr 23.34).</span></p> <p><span>If you need step free access to these services&#160;please phone assisted travel on 0800 138 1016 to discuss alternatives and/or book assistance if required.</span><span><span></span></span><span></span> </p> </span></span></span></span> <p>&#160;</p>","SN",,"A8052669351448D6806DF3EEDDEED757"
"EWR","East Worthing","CPancutt","18/11/2013",528300,"EAST WORTHING","Ham Road","Worthing","West Sussex",,,"BN14 8ED",-0.354885361,50.82163957,"SN","unstaffed","Y",,,"Announcements, ArrivalScreens","<p>Help points are located on each platform.</p>","Y",,"N",,"TicketMachine","Y","N","N","NotAvailable","N",,"N","Y","TicketMachine","Y","<p>Southern's smartcard is called 'the key'.  To apply online, please go to <a href=""http://www.southernrailway.com/thekey"">www.southernrailway.com/thekey</a> or pick up an application form from a Southern ticket office. </p>",,,,,"N","<p> <p><strong>Cycle restrictions on Southern trains from this station</strong></p> <p>0744 to Brighton - cycles cannot be carried at all on this train<br/>0807 to Brighton - cycles cannot be carried at all on this train<br/>0824 to Brighton - cycles cannot be carried at all on this train<br/>1746 to Littlehampton - cycles cannot be carried on this train<br/>1808 to Littlehampton- cycles cannot be carried on this train<br/>1823 to Portsmouth Harbour - cycles cannot be carried on this train<br/>1851to Southampton Central - cycles cannot be carried on this train<br/></p> <p>Please visit <a href="""" http://www.southernrailway.com/your-journey/cycle-policy/"""" target=""""_blank"""">www.southernrailway.com/cyclepolicy</a> for more information</p> </p>",,,,,"N",,,,,,,"N",,,,"N","Y",,,"N",,"N",,"N","N",,"N",,"N","N",,"&lt;p&gt;&lt;a href=&quot;&quot;http://btopenzone.hotspot-directory.com/results.php?txtQuick=BN14 8ED&amp;z=9&amp;radRoaming=1&quot;&quot; target=&quot;&quot;_blank&quot;&quot;&gt;Find WiFi Hotspots around East Worthing station&lt;/a&gt;&lt;/p&gt;","N",,"N","N",,"N",,"N",,"N",,"N",,,,,,"N","Y","<p>Located at the bottom of the ramp on Platform 1 </p>","Y","<p>Unmanned Station</p>","N","N","<p>For information contact local taxi companies, details of which can be found at www.traintaxi.co.uk.</p>",,,"N",,"<p>Steep ramps to platforms.  Thin platforms (2m) mean ramps canot be deployed. </p>","Y",,,,"N",,"N",0,"No","Y",,,,"<p>Down from station at existing bus stops on corner of Chesswood Road and Ham Road.</p>",,"<p>Information on taxis from this station is available at www.traintaxi.co.uk</p>","<p>Information to plan your onward journey is available in a printable format <a href=""""http://www.nationalrail.co.uk/posters/EWR.pdf"""">here</a></p>",,,,,,,"SN",,"AF53B45E12D54CC3BBF90D3D64906359"
"EBN","Eastbourne","CRaan","21/03/2014",544800,"EASTBOURNE.","Terminus Road","Eastbourne",,,,"BN21 3QJ",0.281258504,50.76936955,"SN","partTime","Y","Yes - from help point, Yes - from ticket office",,"DepartureScreens, Announcements","<p>Staffed information point at the station</p>","Y",,"Y","<p>Ticket machines are located on the Concourse</p>","TicketMachine","Y","N","N","NotAvailable","N",,"N","Y","TicketMachine","Y","<p>Southerns smart card is called the key, you can apply at <a href=""http://www.southernrailway.com/thekey"">www.southernrailway.com/thekey</a>or pick up a application form from a Southern ticket office.</p>",,,,,"N","<p>Please contact Customer Services on 08451 272920 or Station Supervisor at the information desk</p> <p><strong>Cycle restrictions on Southern trains from this station<br/></strong>0542 to London Bridge - cycles cannot be carried beyond Lewes<br/>0624 to London Bridge - cycles cannot be carried beyond Lewes<br/>0657 to Victoria - cycles cannot be carried beyond Lewes<br/>0714 to London Bridge - cycles cannot be carried beyond Lewes<br/>0732 to Victoria - cycles cannot be carried beyond Lewes<br/>0747 to Brighton - cycles cannot be carried at all on this train<br/>0757 to Victoria - cycles cannot be carried beyond Lewes<br/>0804 to Brighton - cycles cannot be carried at all on this train<br/>0818 to Victoria - cycles cannot be carried at all on this train<br/>0845 to Brighton - cycles cannot be carried at all on this train<br/>1709 to Ashford - cycles cannot be carried at all on this train<br/>1740 to Ore - cycles cannot be carried at all on this train<br/>1809 to Ashford - cycles cannot be carried at all on this train</p> <p>Please visit <a href=""""http://www.southernrailway.com/cyclepolicy"""">www.southernrailway.com/cyclepolicy</a> for more information</p>",,,,,"N",,,,,,,"N","Please call customer services on 08451 272 920",,,"N","Y",,"Waiting lounge on concourse. Also seating available on platforms.","Y",,"Y","Food outlet (Seating available)","Y","Y",,"Y",,"N","N",,"&lt;p&gt;&lt;a href=&quot;&quot;http://btopenzone.hotspot-directory.com/results.php?txtQuick=BN21 3QJ&amp;z=9&amp;radRoaming=1&quot;&quot; target=&quot;&quot;_blank&quot;&quot;&gt;Find WiFi Hotspots around Eastbourne station&lt;/a&gt;&lt;/p&gt;","N",,"N","Y","Outside the station","N",,"Y","Located on concourse","N","Flower stall Hairdresser Wide range of shops Passport Photo Booth","Y","<p>Please call the Assisted travel team on 0800 138 1016</p>","Please call the Assisted travel team on 0800 138 1016",,,,"Y","Y",,"Y","<p>Passengers unable to use high level windows may request assistance from staff or contact Southern Assisted Travel in advance of travel on 0800 138 1018</p>","N","Y","<p>Accessible taxis to stations with steps only can be arranged through Southern Assisted Travel - 0800 138 1018. For other taxi journeys, contact local taxi companies, details of which can be found at www.traintaxi.co.uk.</p>",,,"Y","<p>Radar Key toilets</p>","<p>Level access to platforms and Ticket Office.</p>","Y",,,"<p>Please be aware there are currently high kerbs from the drop off point to the station entrance.</p>","Y",,"Y",120,"Yes","Y","Stands at the front of the station and sheltered stands near the car park","<p><strong></strong></p> <p><strong>Cycle restrictions onboard Southern trains from this station:<br/></strong>0542 to London Bridge - cycles cannot be carried beyond Lewes<br/>0624 to London Bridge - cycles cannot be carried beyond Lewes<br/>0637 to Brighton - cycles cannot be carried beyond Lewes<br/>0647 to Brighton - cycles cannot be carried beyond Lewes<br/>0657 to Victoria - cycles cannot be carried beyond Lewes<br/>0714 to London Bridge - cycles cannot be carried beyond Lewes<br/>0732 to Victoria - cycles cannot be carried beyond Lewes<br/>0747 to Brighton - cycles cannot be carried at all on this train<br/>0757 to Victoria - cycles cannot be carried beyond Lewes<br/>0804 to Brighton - cycles cannot be carried at all on this train<br/>0818 to Victoria - cycles cannot be carried beyond Lewes<br/>0845 to Brighton - cycles cannot be carried at all on this train<br/>0904 to Brighton - cycles cannot be carried at all on this train<br/>Visit <a href=""""http://www.southernrailway.com/cyclepolicy"""">www.southernrailway.com/cyclepolicy</a></p> <p><br/></p>","Stands","<p>Taxi Rank in Ashford Road (adjacent to Platform 3).</p>",,,"<p>Information to plan your onward journey is available in a printable format <a href=""""http://www.nationalrail.co.uk/posters/EBN.pdf"""">here</a></p>",,,,"<p>10 minute walk from Town Centre</p>","Yellowbike<br />www.yellowbike.biz",,"SN",,"3D9A76AA5A714484A6ED72B65A8A0606"
"EBR","Edenbridge","kmonk","11/12/2013",547300,"EDENBRIDGE","Station Road","EDENBRIDGE","Kent",,,"TN8 6HR",0.060654046,51.20843113,"SN","unstaffed","Y","Yes - from help point",,"DepartureScreens, Announcements",,"Y",,"N",,"NotAvailable","Y","N","N","NotAvailable","N",,"N","N","NotAvailable","N",,,,,,"N","<p>Please call Customer Services on 0845 127 2920</p>",,,,,"N",,,,,,,"Y",,,,"N","Y",,"Waiting shelters on platform","Y",,"N",,"N","N",,"N",,"N","N",,"&lt;p&gt;&lt;a href=&quot;&quot;http://btopenzone.hotspot-directory.com/results.php?txtQuick=TN8 6HR&amp;z=9&amp;radRoaming=1&quot;&quot; target=&quot;&quot;_blank&quot;&quot;&gt;Find WiFi Hotspots around Edenbridge station&lt;/a&gt;&lt;/p&gt;","N",,"N","N","Outside the station","N",,"N",,"N",,"N","<p>Plesae call Assisted travel team on 0800 138 1016</p>","Plesae call Assisted travel team on 0800 138 1016",,"<p>Station is not staffed</p>",,"N","Y",,"Y","<p>Unmanned Station</p>","N","N",,,,"N",,"<p>Platform 2 suitable for wheelchair access. Nearest alternative stations are Tonbridge or Redhill.</p>","N",,,,"N",,"N",0,"No","Y",,,,,,,"<p>Information to plan your onward journey is available in a printable format <a href=""""http://www.nationalrail.co.uk/posters/EBR.pdf"""">here</a></p>",,,,,,,"SN",,"31FA7A899A324DCBA277ABFE45400EBD"
"EBT","Edenbridge Town","CRaan","21/03/2014",535900,"EDENBRIDGE TOWN","Station Approach","Edenbridge","Kent",,,"TN8 5LP",0.067180931,51.20007799,"SN","partTime","Y","Yes - from help point, Yes - from ticket office",,"Announcements, ArrivalScreens","<p>White in colour , Located on both platforms .</p>","Y",,"Y","<p>Ticket machines are located outside front of the station</p>","TicketMachine","Y","N","N","NotAvailable","N",,"N","Y","TicketMachine","Y","<p>Southerns smart card is called the key, you can apply at <a href=""http://www.southernrailway.com/thekey"">www.southernrailway.com/thekey</a>or pick up an application form from a southern office.</p>",,,,,"N","<p>Please call Customer services on 08451 272 920</p>",,,,,"N",,,,,,,"N","Please call Customer services on 08451 272 920",,,"N","Y",,"Seats in ticket office with space for wheelchair. Platform 1 has a roof with 2 seats underneath. Platform 2 - open fronted shelter with 1 step to access , 2 metal seats inside. Further 1 seat on platform.","Y",,"N",,"N","N",,"N",,"N","Y","CardsAndCoins","&lt;p&gt;&lt;a href=&quot;&quot;http://btopenzone.hotspot-directory.com/results.php?txtQuick=TN8 5LP&amp;z=9&amp;radRoaming=1&quot;&quot; target=&quot;&quot;_blank&quot;&quot;&gt;Find WiFi Hotspots around Edenbridge Town station&lt;/a&gt;&lt;/p&gt;","N",,"N","Y","Outside the station","N",,"N",,"N",,"N","<p>Please call the Assisted travel team on 0800 138 1016</p>","Please call the Assisted travel team on 0800 138 1016",,,,"Y","Y",,"N",,"N","Y","<p>Accessible taxis to/from this station to/from the nearest accessible station can be arranged through Southern Assisted Travel - 0800 138 1016 For other taxi journeys, contact local taxi companies, details of which can be found at www.traintaxi.co.uk.</p>",,"<p>Hurst Green</p>","N",,"<p>Step free access to platform 1 (to London) and Ticket Office. Subway with steps to platform 2 (to Uckfield). Nearest step-free staffed stations are Tonbridge or Redhill. Nearest step-free station staffed part time is Hurst Green.</p>","N",,,,"Y",,"N",10,"Yes","Y","Station front",,"Stands","<p>Outside station in Station Aproach.</p>",,"<p>Information on taxis from this station is available at www.traintaxi.co.uk</p>","<p>Information to plan your onward journey is available in a printable format <a href=""""http://www.nationalrail.co.uk/posters/EBT.pdf"""">here</a></p>",,,,,,,"SN",,"A623A10174064838881F9D4B9FDFE619"
"EMS","Emsworth","CPancutt","18/11/2013",525700,"EMSWORTH","North Street","Emsworth","Hampshire",,,"PO10 7PN",-0.93878361,50.85138028,"SN","partTime","Y",,,"Announcements, ArrivalScreens","<p>Located on Platform 2  </p>","Y",,"Y","<p>Located in the booking hall</p>","TicketMachine","Y","N","N","NotAvailable","N",,"N","Y","TicketMachine","Y","<p>Southern's smartcard is called 'the key'.  To apply online, go to <a href=""http://www.southernrailway.com/thekey"">www.southernrailway.com/thekey</a> or pick up an application form from a Southern ticket office. </p>",,,,,"N","<p> <p><strong>Cycle restrictions on Southern trains from this station</strong></p> <p>0611 to Victoria - cycles cannot be carried beyond Horsham<br/>0642 to London Bridge - cycles cannot be carried beyond Horsham</p> <p>0657 to Brighton - cycles cannot be carried beyond Worthing<br/>0711 to Victoria - cycles cannot be carried beyond Horsham</p> <p>0752 to Victoria - cycles cannot be carried beyond Horsham</p> <p>Please visit <a href=""""http://www.southernrailway.com/your-journey/cycle-policy/"""" target=""""_blank"""">www.southernrailway.com/cyclepolicy</a> for more information</p> </p>",,,,,"N",,,,,,,"N",,,,"N","Y",,,"N",,"N",,"N","Y",,"N",,"N","Y","CardsAndCoins","&lt;p&gt;&lt;a href=&quot;&quot;http://btopenzone.hotspot-directory.com/results.php?txtQuick=PO10 7PN&amp;z=9&amp;radRoaming=1&quot;&quot; target=&quot;&quot;_blank&quot;&quot;&gt;Find WiFi Hotspots around Emsworth station&lt;/a&gt;&lt;/p&gt;","N",,"N","N",,"N",,"N",,"N",,"N",,,,,,"Y","Y","<p>Quickfare Machine By Main Entrance .</p>","N",,"N","N","<p>Accessible taxis to/from this station to/from the nearest accessible station can be arranged through Southern Assisted Travel - 0800 138 1016. For other taxi journeys, contact local taxi companies, details of which can be found at www.traintaxi.co.uk.</p>",,"<p>The nearest station(s) with more facilities than Emsworth are:</p> <ul> <li>Havant</li> </ul>","N",,"<p>Step free access to both platforms via ramps. </p>","Y",,,,"Y",,"N",4,"Yes","Y","station front",,"Stands","<p>Down from station on A259 Havant Road.</p>",,"<p>Information on taxis from this station is available at www.traintaxi.co.uk</p>","<p>Information to plan your onward journey is available in a printable format <a href=""""http://www.nationalrail.co.uk/posters/EMS.pdf"""">here</a></p>",,,,,,,"SN",,"2C49574DB36F41F6B6913608BF46FF53"
"EPS","Epsom (Surrey)","CPancutt","19/11/2013",536000,"EPSOM","Station Road","Epsom","Surrey",,,"KT19 8EU",-0.268778341,51.3343926,"SN","fullTime","Y",,,"DepartureScreens, Announcements","<p>Customer assistance office on platform 2.  Help is available via the help points on each platform.</p>","Y",,"Y","<p>Located in the booking hall</p>","TicketMachine","Y","N","N","NotAvailable","N",,"N","Y","TicketMachine","Y","Southern's smartcard is called&nbsp;'the key'.&nbsp;&nbsp;To apply online go to <A href=""http://www.southernrailway.com/thekey"">www.southernrailway.com/thekey</A> or pick up an application form from a&nbsp;Southern ticket office.",,,,,"N","<P>Please call Customer Services on 08451 272920</P>",,,,,"N",,,,,,,"N",,,,"N","Y",,,"Y",,"N",,"Y","Y","Toilets (male, female &amp;&nbsp;accessible) are all located on Platforms 1/2 & 3/4&nbsp;","Y","Female toilets","N","N",,"&lt;p&gt;&lt;a href=&quot;&quot;http://btopenzone.hotspot-directory.com/results.php?txtQuick=KT19 8EW&amp;z=9&amp;radRoaming=1&quot;&quot; target=&quot;&quot;_blank&quot;&quot;&gt;Find WiFi Hotspots around Epsom station&lt;/a&gt;&lt;/p&gt;","N",,"N","N",,"N",,"Y","Located outside the station","N","News agent Passport Photo Booth","Y",,,,,,"Y","Y",,"Y",,"Y","Y","<p>Accessible taxis to/from this station to/from the nearest accessible station can be arranged through Southern Assisted Travel - 0800 138 1016. For other taxi journeys, contact local taxi companies, details of which can be found at www.traintaxi.co.uk.</p>",,,"Y","Located on Platform 2 and Platform 3","<p>Level access from street to Ticket Office. Staff-operated lift access to all platforms.</p>","Y",,,"<p>In Car Park</p>","Y",,"Y",132,"Yes","Y","subway",,"Stands","<p>Outside station on Station Approach.</p>",,"<p>Information on taxis from this station is available at www.traintaxi.co.uk</p>","<p>Information to plan your onward journey is available in a printable format <a href=""""http://www.nationalrail.co.uk/posters/EPS.pdf"""">here</a></p>",,,,,,,"SN",,"C67A9A8B99B242538C23EF7FBFC23478"
"EPD","Epsom Downs","CPancutt","19/11/2013",536100,"EPSOM DOWNS","Longdown Lane","Epsom","Surrey",,,"KT17 4JX",-0.238954739,51.323687,"SN","unstaffed","Y",-1,,"Announcements, ArrivalScreens","<P>Customer help points located in shelter.</P>","Y",,"N",,"NotAvailable","Y","N","Y","TicketMachine","Y",,"N","N","NotAvailable","N",,"Zone 6",,,,"Y",,,,,,"N",,,,,,,"N",,,,"N","N",,,"N",,"N",,"N","N",,"N",,"N","Y","CardsAndCoins","&lt;p&gt;&lt;a href=&quot;&quot;http://btopenzone.hotspot-directory.com/results.php?txtQuick=KT17 4JX&amp;z=9&amp;radRoaming=1&quot;&quot; target=&quot;&quot;_blank&quot;&quot;&gt;Find WiFi Hotspots around Epsom Downs station&lt;/a&gt;&lt;/p&gt;","N",,"N","N",,"N",,"N",,"N",,"N",,,,,,"N","Y","<p>QuickfareMachine Can Be Located In Car Park .</p>","N","<p>Unmanned Station .</p>","N","N","<p>Accessible taxis to/from this station to/from the nearest accessible station can be arranged through Southern Assisted Travel - 0800 138 1016. For other taxi journeys, contact local taxi companies, details of which can be found at www.traintaxi.co.uk.</p>",,"<p>The nearest station(s) with more facilities than Epsom Downs are:</p> <ul> <li>Epsom</li> </ul> <p> </p>","N",,"<p>Level access to platforms. </p>","Y",,,"<p>No dedicated impaired mobility pick up / set down area, however this can be done at the front of the station.</p>","N",,"N",10,"Yes","Y","Station front",,"Stands","<p>Down from station at existing bus stops on Longdown Lane South.</p>",,"<p>Information on taxis from this station is available at www.traintaxi.co.uk</p>","<p>Information to plan your onward journey is available in a printable format <a href=""""http://www.nationalrail.co.uk/posters/EPD.pdf"""">here</a></p>",,,,,,,"SN",,"D7C2A2420C6241CF843954FC28DF7FE5"
