"HOV","Hove","CRaan","21/03/2014",527300,"HOVE.","Goldstone Villas","Hove","East Sussex",,,"BN3 3RU",-0.170687991,50.8352109,"SN","fullTime","Y",,,,,"N",,"Y","<p>Located in the booking hall</p>","TicketMachine","Y","N","N","NotAvailable","N",,"N","Y","TicketMachine","Y","<p>Southerns smart card is called the key, you can apply at <a href=""http://www.southernrailway.com/thekey"">www.southernrailway.com/thekey</a> or pick up an application form from a southern ticket office.</p> <p> </p>",,,,,"N","<p>&nbsp;</p> <p><strong>Cycle restrictions on Southern trains from this station</strong></p> <p>0557 to Victoria - cycles cannot be carried on this train</p> <p>0631 to London Bridge - cycles cannot be carried on this train</p> <p>0711 to London Bridge - cycles cannot be carried on this train</p> <p>0721 to Victoria - cycles cannot be carried on this train</p> <p>0741 to Victoria - cycles cannot be carried on this train</p> <p>0756 to Brighton - cycles cannot be carried on this train</p> <p>0804 to Brighton - cycles cannot be carried on this train</p> <p>0808 to Victoria - cycles cannot be carried on this train</p> <p>0827 to Brighton - cycles cannot be carried on this train</p> <p>0834 to Brighton - cycles cannot be carried on this train</p> <p>0844 to Brighton - cycles cannot be carried on this train</p> <p>0852 to Victoria - cycles cannot be carried on this train</p> <p>0914 to Brighton - cycles cannot be carried on this train</p> <p>1637 to Southampton Central - cycles cannot be carried on this train</p> <p>1707 to Portsmouth Harbour - cycles cannot be carried on this train</p> <p>1727 to Littlehampton - cycles cannot be carried on this train</p> <p>1737 to Southampton Central - cycles cannot be carried on this train</p> <p>1749 to Littlehampton - cycles cannot be carried on this train</p> <p>1804 to Portsmouth Harbour - cycles cannot be carried on this train</p> <p>1832 to Southampton Central - cycles cannot be carried on this train</p> <p>Please visit <a href="""">www.southernrailway.com/cyclepolicy</a> for more information</p> <p>&nbsp;</p>",,,,,"N",,,,,,,"N","Please call Customer services on 0845 1272 920",,,"N","Y",,,"Y",,"N",,"Y","Y",,"Y",,"N","Y","CardsAndCoins","&lt;p&gt;&lt;a href=&quot;&quot;http://btopenzone.hotspot-directory.com/results.php?txtQuick=BN3 3RU&amp;z=9&amp;radRoaming=1&quot;&quot; target=&quot;&quot;_blank&quot;&quot;&gt;Find WiFi Hotspots around Hove station&lt;/a&gt;&lt;/p&gt;","Y",,"N","N",,"N",,"Y","Located by the ticket office","N","News agent Flower stall","Y",,"Please call the Assisted travel team on 0800 138 1016",,,,"Y","Y","<p>Quickfare machine can be located in the Booking Hall.</p>","Y",,"N","Y","<p>Accessible taxis to/from this station to/from the nearest accessible station can be arranged through Southern Assisted Travel - 08001381016other taxi journeys, contact local taxi companies, details of which can be found at www.traintaxi.co.uk.</p>",,"<p>Brighton </p>","Y",,"<p>Step-free access via passenger-operated lifts to all platforms. Step-free access to Ticket Office.</p>","Y",,,"<p>Designated Area is Main entrance to station this is clearly marked .</p>","Y","Available during staffed hours","Y",100,"Yes","Y","station front",,"Stands","<p>Outside station at existing bus stops on Goldstone Villas.</p>",,"<p>Information on taxis from this station is available at www.traintaxi.co.uk</p>","<p>Information to plan your onward journey is available in a printable format <a href=""""http://www.nationalrail.co.uk/posters/HOV.pdf"""">here</a></p>",,,,,,,"SN",,"9F512939071B4FDF8B51AC399C433CD7"
"HUR","Hurst Green","CRaan","21/03/2014",546300,"HURST GREEN","Greenhurst Lane","Hurst Green","Surrey",,,"RH8 0LL",0.003945749,51.24442735,"SN","partTime","Y",,,"Announcements, ArrivalScreens","<p>White in colour , Can be located on both platforms .</p>","Y",,"Y","<p>Ticket machines are located in front of station</p>","TicketMachine","Y","N","N","NotAvailable","N",,"N","N","NotAvailable","N",,,,,,"N",,,,,,"N",,,,,,,"N",,,,"N","Y",,,"Y",,"N","Coffee shop","Y","Y",,"N",,"N","N","CardsAndCoins","&lt;p&gt;&lt;a href=&quot;&quot;http://btopenzone.hotspot-directory.com/results.php?txtQuick=RH8 0LL&amp;z=9&amp;radRoaming=1&quot;&quot; target=&quot;&quot;_blank&quot;&quot;&gt;Find WiFi Hotspots around Hurst Green station&lt;/a&gt;&lt;/p&gt;","N",,"N","N",,"N",,"N",,"N",,"N",,,,,,"Y","Y","<p> Quickfare Machine can be located by Ticket Office entrance .</p>","Y",,"Y","N","<p>Accessible taxis to/from this station to/from the nearest accessible station can be arranged through Southern Assisted Travel - 0800 1381016 other taxi journeys, contact local taxi companies, details of which can be found at www.traintaxi.co.uk.</p>",,,"N",,"<p>Step-free access from main car park to platform 1 (to London) via side gate. 1 curb to access Ticket Office, although step-free route via platform 1. Step-free access to platform 2 (to Uckfield/East Grinstead) from pavement adjoining rear car park, although no dropped curb. Footbridge with steps between platforms. Route between platforms via street and overbridge is steep and likely to be unsuitable for wheelchair users.</p>","Y",,,"<p>Designated area is in the Platform 1 Car Park .</p>","Y",,"N",6,"Yes","Y","station front","<p>cycle lockers are available</p>","Lockers","<p>Station forecourt.</p>",,"<p>Information on taxis from this station is available at www.traintaxi.co.uk</p>","<p>Information to plan your onward journey is available in a printable format <a href=""""http://www.nationalrail.co.uk/posters/HUR.pdf"""">here</a></p>",,,,,,,"SN",,"5DE1AA0961D04EE9A4C250F41E16C354"
"IFI","Ifield","CPancutt","26/11/2013",549500,"IFIELD","Ifield Drive","Crawley","West Sussex",,,"RH11 0JP",-0.214772632,51.11561646,"SN","partTime","Y",,,,,"Y",,"Y","<p>Located in the booking hall</p>","TicketMachine","Y","N","N","NotAvailable","N",,"N","Y","TicketMachine","Y","Southern's smartcard is called 'the key'.&nbsp; To apply online go to <A href=""http://www.southernrailway.com/thekey"">www.southernrailway.com/thekey</A> or pick up an application form from a Southern ticket office.",,,,,"N",,,,,,"N","Call Customer Services 08451 272920",,,,,,"N","Call Customer Services 08451 272920",,,"N","Y",,,"N","Shelter on both platforms with seat inside. 1 further seat on platform 1.","N",,"N","N",,"N",,"N","N",,"&lt;a href=&#39;http://btopenzone.hotspot-directory.com/results.php?txtQuick=RH11 0JP&amp;z=9&amp;radRoaming=1&#39; target=&#39;_blank&#39;&gt;Find WiFi Hotspots around Ifield station&lt;/a&gt;","N",,"N","N",,"N",,"N",,"N",,"N",,,,,,"Y","Y","<p>Quickfare/ Pertis machines are not low level and have non-compliant user-operated parts.</p>","Y","<p>Passengers unable to use high level windows may request assistance from Southern Assisted Travel on 08451 23 77 70.</p>","N","N","<p>Accessible taxis to/from this station to/from the nearest accessible station can be arranged through Southern Assisted Travel - 08451 23 77 70. For other taxi journeys, contact local taxi companies, details of which can be found at www.traintaxi.co.uk.</p>",,,"N",,"<p>Step-free access to both platforms, via steep ramps, from separate entrances. No step free interchange between platforms.</p>","Y",,,,"Y",,"N",6,"No","Y","entrance","<p>Lockers are hired for 3 months (13 weeks) £20 6 months (26 weeks) £40 12 months (52 weeks) £70</p>",,"<p>Up from station at existing bus stops on Ifield Drive.</p>",,"<p>Information on taxis from this station is available at www.traintaxi.co.uk</p>","<p>Information to plan your onward journey is available in a printable format <a href=""""http://www.nationalrail.co.uk/posters/IFI.pdf"""">here</a></p>",,,,,,,"SN",,"9B342D27B58A491F8B46830F5A05C1DF"
"KLY","Kenley","CRaan","21/03/2014",541900,"KENLEY","Kenley Lane","Kenley","Surrey",,,"CR8 5JA",-0.101215735,51.32460105,"SN","fullTime","Y","Yes - from help point, Yes - from ticket office",,"DepartureScreens, Announcements","<P>Located on both platforms.</P>","Y","Ticket office is open Mon-Sat 06:05-00:40 and Sun 07:35-00:20","Y","<p>Ticket office is open Mon-Sat 06:05-00:40 and Sun 07:35-00:20.</p><p>Ticket machines (including Accessible Quickfare) are located on Platform 1 and in car park</p>","TicketMachine","Y","N","N","NotAvailable","Y","Oyster cards with a pre-loaded deposit only are available from ticket office. Top-up only from self-service ticket machine(s)","N","N","NotAvailable","N",,"Zone 6",,,,"Y","<p>Contact Customer Services on 08451 272920</p>",,,,,"N",,,,,,,"N",,,,"N","Y",,,"N",,"N","Costa vending machine","Y","N",,"N",,"N","Y","CardsAndCoins","&lt;p&gt;&lt;a href=&quot;&quot;http://btopenzone.hotspot-directory.com/results.php?txtQuick=CR8 5JA&amp;z=9&amp;radRoaming=1&quot;&quot; target=&quot;&quot;_blank&quot;&quot;&gt;Find WiFi Hotspots around Kenley station&lt;/a&gt;&lt;/p&gt;","N",,"N","Y",,"N",,"N",,"N",,"N",,,,,,"Y","Y","<p>Quickfare Machine located on platform 1 .</p>","Y",,"Y","Y","<p>Accessible taxis to/from this station to/from the nearest accessible station can be arranged through Southern Assisted Travel - 0800 138 1016. For other taxi journeys, contact local taxi companies, details of which can be found at www.traintaxi.co.uk.</p>",,,"N",,"Step-free access via side gates from either side of the station to platforms. Step-free interchange route between platforms via a narrow, steep footpath with&nbsp;one kerb.","Y",,,"<p>Designated Area Is in the Car Park .</p>","Y",,"N",16,"Yes","Y","Sheltered cycle storage in the car park, cycle rack available at front",,"Stands","<p>Along from station on A22 Godstone Road.</p>",,"<p>Information on taxis from this station is available at www.traintaxi.co.uk</p>","<p>Information to plan your onward journey is available in a printable format <a href=""""http://www.nationalrail.co.uk/posters/KLY.pdf"""">here</a></p>",,,,,,,"SN",,"2EE40C1F172C4712B2044C00CCB37291"
"KND","Kingswood","CRaan","21/03/2014",536600,"KINGSWOOD","Station Yard","Waterhouse Lane","Kingswood","Surrey",,"KT20 6EN",-0.211456639,51.29486144,"SN","partTime","Y",,,"DepartureScreens, Announcements","<p>White in colour located on both platforms .</p>","Y",,"Y","<p>Located in the booking hall</p>","TicketMachine","Y","N","Y","TicketMachine","Y",,"N","N","NotAvailable","N",,"Zone 6",,,,"Y","<p>Please call customer services on 08451 272 920</p>",,,,,"N",,,,,,,"N","Please call customer services on 08451 272 920",,,"N","Y",,,"N",,"N",,"N","Y","<p>Toliets located in booking hall</p>","N",,"N","N",,"&lt;p&gt;&lt;a href=&quot;&quot;http://btopenzone.hotspot-directory.com/results.php?txtQuick=KT20 6EN&amp;z=9&amp;radRoaming=1&quot;&quot; target=&quot;&quot;_blank&quot;&quot;&gt;Find WiFi Hotspots around Kingswood station&lt;/a&gt;&lt;/p&gt;","N",,"N","N",,"N",,"N",,"N",,"N","<p>Please call the Assisted travel team on 0800 138 1016</p>","Please call the Assisted travel team on 0800 138 1016",,,,"Y","Y","<p>Quickfare Machine can be located on platform 1 and 2 </p>","Y",,"N","Y","<p>Accessible taxis to/from this station to/from the nearest accessible station can be arranged through Southern Assisted Travel - 08001381016. For other taxi journeys, contact local taxi companies, details of which can be found at www.traintaxi.co.uk.</p>",,"<p>The nearest station(s) with more facilities than Kingswood are:</p> <ul> <li>Tadworth</li> <li>Sutton</li> </ul>","N",,"<p>Step-free access from main entrance to platform 1 (to London) via side gate. Steps to Ticket Office, although can be accessed via platform 1 and small 6cm step. Step-free access from rear entrance direct to platform 2 (to Tattenham Corner). No step-free access between platforms - footbridge with steps; route via street and road overbridge is narrow and steep in places.</p>","Y",,,"<p>Designated area is in the Car Park .</p>","Y",,"N",10,"Yes","Y","beside station",,"Stands","<p>Outside station on Waterhouse Lane.</p>",,"<p>Information on taxis from this station is available at www.traintaxi.co.uk</p>","<p>Information to plan your onward journey is available in a printable format <a href=""""http://www.nationalrail.co.uk/posters/KND.pdf"""">here</a></p>",,,,,,,"SN",,"B079990F0EB9412A9DC8FD6B505122B0"
"LAC","Lancing","CRaan","21/03/2014",527500,"LANCING","South Street","Lancing","West Sussex",,,"BN15 8AG",-0.323099956,50.82707775,"SN","partTime","Y",,,"DepartureScreens, Announcements","<p>White in colour , can be located on platform 1 by entrance . and platform 2 half way down platform .</p>","Y",,"Y","<p>Located in the booking hall</p>","TicketMachine","Y","N","N","NotAvailable","N",,"N","N","NotAvailable","Y","<p>Southerns smart card is called the key, you can apply at <a href=""http://www.southernrailway.com/thekey"">www.southernrailway.com/thekey</a> or pick up a application form from a Southern ticket office.</p>",,,,,"N","<p> <p><strong>Cycle restrictions on Southern trains from this station</strong></p> <p>0545 to Victoria - cycles cannot be carried beyond Hove<br/>0618 to London Bridge - cycles cannot be carried beyond Hove<br/>0657 to London Bridge - cycles cannot be carried beyond Hove<br/>0707 to Victoria - cycles cannot be carried beyond Hove<br/>0727 to Victoria - cycles cannot be carried beyond Hove<br/>0742 to Brighton - cycles cannot be carried at all on this train<br/>0747 to Brighton - cycles cannot be carried at all on this train<br/>0754 to Victoria - cycles cannot be carried beyond Hove<br/>0810 to Brighton - cycles cannot be carried at all on this train<br/>0820 to Brighton - cycles cannot be carried at all on this train<br/>0827 to Brighton - cycles cannot be carried at all on this train<br/>0839 to Victoria - cycles cannot be carried beyond Hove<br/>0900 to Brighton - cycles cannot be carried at all on this train<br/>1650 to Southampton Central - cycles cannot be carried on this train<br/>1720 to Portsmouth Harbour - cycles cannot be carried on this train<br/>1743 to Littlehampton - cycles cannot be carried on this train<br/>1750 to Southampton Central - cycles cannot be carried on this train<br/>1805 to Littlehampton - cycles cannot be carried on this train<br/>1820 to Portsmouth Harbour - cycles cannot be carried on this train<br/>1848 to Southampton Central - cycles cannot be carried on this train<br/></p> <p>Please visit <a href=""""http://www.southernrailway.com/your-journey/cycle-policy/"""" target=""""_blank"""">www.southernrailway.com/cyclepolicy</a> for more information</p> </p>",,,,,"N",,,,,,,"N","Please call customer service on 08451 272 920",,,"N","Y",,"Seating available in shelters on platform 1 and 2","N",,"N",,"N","N",,"N",,"N","N","CardsAndCoins","&lt;p&gt;&lt;a href=&quot;&quot;http://btopenzone.hotspot-directory.com/results.php?txtQuick=BN15 8AG&amp;z=9&amp;radRoaming=1&quot;&quot; target=&quot;&quot;_blank&quot;&quot;&gt;Find WiFi Hotspots around Lancing station&lt;/a&gt;&lt;/p&gt;","N",,"N","N",,"N",,"N",,"N",,"N","<p>Please call the Assisted travel team on 0800 138 1016</p>","Please call the Assisted travel team on 0800 138 1016",,,,"Y","Y","<p>Quickfare Machines can be located in by shelter on platform 1 , and by front entrance to station . </p>","Y",,"N","Y","<p>Accessible taxis to/from this station to/from the nearest accessible station can be arranged through Southern Assisted Travel - 08451 23 77 70. For other taxi journeys, contact local taxi companies, details of which can be found at www.traintaxi.co.uk.</p>",,"<p>Worthing</p>","N",,"<p>Step-free access from main entrance to platform 2 (to Littlehampton/Bognor) via side gate. Steps from street to Ticket Office, although can be accessed step-free via platform 2. Step-free access to platform 1 (to Brighton/London) via separate entrance. Level crossing between platforms.</p>","Y",,,"<p>No dedicated area</p>","Y",,"N",34,"Yes","Y","station front, outside lease areas WSCC",,,"<p>Station forecourt.</p>",,"<p>Information on taxis from this station is available at www.traintaxi.co.uk</p>","<p>Information to plan your onward journey is available in a printable format <a href=""""http://www.nationalrail.co.uk/posters/LAC.pdf"""">here</a></p>",,,,,,,"SN",,"0266A7AA90A44047926FD852372BF8E7"
"LHD","Leatherhead","CRaan","21/03/2014",536800,"LEATHERHEAD","Station Approach","Leatherhead","Surrey",,,"KT22 7SQ",-0.333064888,51.29875147,"SN","fullTime","Y","Yes - from ticket office",,"DepartureScreens, Announcements",,"N",,"Y","<p>Ticket machines located outside the front of the station and on Platform 2.</p>","TicketMachine","Y","N","N","NotAvailable","N",,"N","N","NotAvailable","Y","<p>Southerns smart card is called the key, you can apply at <a href=""http://www.southernrailway.com/thekey"">www.southernrailway.com/thekey</a> or pick up a application form from a Southern ticket office.</p>",,,,,"N","<p>Please contact Customer Services on 08451 272920.</p>",,,,,"N",,,,,,,"N","Please call customer service on 08451 272 920",,,"N","Y",,"Platform 2","Y","<p>Platform 2 </p>","N","Food outlet (Seating available)","Y","Y",,"N",,"N","Y","CardsAndCoins","&lt;p&gt;&lt;a href=&quot;&quot;http://btopenzone.hotspot-directory.com/results.php?txtQuick=KT22 7SQ&amp;z=9&amp;radRoaming=1&quot;&quot; target=&quot;&quot;_blank&quot;&quot;&gt;Find WiFi Hotspots around Leatherhead station&lt;/a&gt;&lt;/p&gt;","N",,"N","Y",,"N",,"N",,"N",,"N","<p>Please call the Assisted travel team on 0800 138 1016</p>","Please call the Assisted travel team on 0800 138 1016",,,,"Y","Y","<p>Located outside main entrance and near gateline on platform 2</p>","Y",,"Y","Y","<p>If you are travelling to a station that is not step free please contact Southern Assisted Travel on 0800 138 1016 for advice. For other taxi journeys, contact local taxi companies, details of which can be found at www.traintaxi.co.uk.</p>",,,"N",,"<p>Step-free access to platform 1 (to London) and ticket office/shop, when open. Step-free access to platform 1 when ticket office/shop closed is via a side entrance with short steep slope. Step-free access to platform 2 (to Dorking/Guildford) via side gate. No step-free access between platforms (subway with steps). Step-free route between platforms is via steep street.</p>","Y",,,"<p>Designated area is in the car park .</p>","Y","Available during staffed hours","Y",80,"Yes","Y","<p>Next to entrances to platforms 1 & 2, and on platform 1</p>",,"Stands","<p>Station forecourt.</p>",,"<p>There is a taxi rank outside the station near the entrance to Platform 2.</p> <p>Information about taxis from this station is available at <a href=""""http://www.traintaxi.co.uk"""">www.traintaxi.co.uk</a></p> <p>Local Taxi numbers</p> <p>Leatherhead 01372 370307</p> <p>MFD 01372 362626</p>","<p>Information to plan your onward journey is available in a printable format <a href=""""http://www.nationalrail.co.uk/posters/LHD.pdf"""">here</a></p>",,,,,,,"SN",,"42319AD222494051BEB16B82A0848CEA"
"LIH","Leigh (Kent)","CPancutt","28/11/2013",529400,"LEIGH (KENT)","Lower Green","Leigh","Kent",,,"TN11 8RU",0.210506799,51.19389559,"SN","unstaffed","Y",,,"DepartureScreens","<P>Automated yellow boxes are located on both platforms.</P>","Y",,"N",,"NotAvailable","N","N","N","NotAvailable","N",,"N","N","NotAvailable","N",,,,,,"N",,,,,,"N",,,,,,,"Y",,,,"N","Y",,,"N",,"N",,"N","N",,"N",,"N","N",,"&lt;p&gt;&lt;a href=&quot;&quot;http://btopenzone.hotspot-directory.com/results.php?txtQuick=TN11 8RU&amp;z=9&amp;radRoaming=1&quot;&quot; target=&quot;&quot;_blank&quot;&quot;&gt;Find WiFi Hotspots around Leigh (Kent) station&lt;/a&gt;&lt;/p&gt;","N",,"N","N",,"N",,"N",,"N",,"N",,,,,,"N","Y",,"Y","<p>Unmanned Station</p>","N","N",,,,"N",,"Long steep ramps to both platforms.&nbsp;","Y",,,,"N",,"N",0,"No","Y",,,,,,,"<p>Information to plan your onward journey is available in a printable format <a href=""""http://www.nationalrail.co.uk/posters/LIH.pdf"""">here</a></p>",,,,,,,"SN",,"D7F1BBF2869548DB89EDB3596357E115"
"LWS","Lewes","CRaan","21/03/2014",532900,"LEWES","Station Street","Lewes","East Sussex",,,"BN7 2UP",0.011335211,50.87062711,"SN","fullTime","Y",,,,"<p>Customer assistance office on concourse between platforms 2 and 3.</p>","Y",,"Y","<p>Located in the booking hall</p>","TicketMachine","Y","N","N","NotAvailable","N",,"N","Y","TicketOffice, TicketMachine","Y","Southern's smartcard is called 'the key'.&nbsp; To apply online go&nbsp;to <A href=""http://www.southernrailway.com/thekey"">www.southernrailway.com/thekey</A>&nbsp;or&nbsp;pick up an&nbsp;application form from a Southern ticket office. &nbsp;&nbsp;",,,,,"N","<p> <p><strong>Cycle restrictions on Southern trains from this station</strong></p> <p>0605 to London Bridge - cycles cannot be carried at all on this train<br/>0651 to London Bridge - cycles cannot be carried at all on this train<br/>0722 to Victoria - cycles cannot be carried at all on this train<br/>0742 to London Bridge - cycles cannot be carried at all on this train<br/>0755 to Victoria - cycles cannot be carried at all on this train<br/>0807 to Brighton - cycles cannot be carried at all on this train<br/>0819 to Brighton - cycles cannot be carried at all on this train<br/>0823 to Victoria - cycles cannot be carried at all on this train<br/>0830 to Brighton - cycles cannot be carried at all on this train<br/>0848 to Victoria - cycles cannot be carried at all on this train<br/>0907 to Brighton - cycles cannot be carried at all on this train<br/>1644 to Ashford International - cycles cannot be carried at all on this train<br/>1709 to Ore - cycles cannot be carried at all on this train<br/></p> <p>Please visit <a href=""""http://www.southernrailway.com/your-journey/cycle-policy/"""" target=""""_blank"""">www.southernrailway.com/cyclepolicy</a> for more information</p> </p>",,,,,"N",,,,,,,"N",,,,"N","Y",,,"Y","Located on Platform 2&nbsp;& 3 and 4 & 5 &nbsp;","Y",,"Y","Y","Toilets located on Platform 2 & 3&nbsp;","Y","Female toilets,Male toilets","N","Y","CardsAndCoins","&lt;p&gt;&lt;a href=&quot;&quot;http://btopenzone.hotspot-directory.com/results.php?txtQuick=BN7 2UP&amp;z=9&amp;radRoaming=1&quot;&quot; target=&quot;&quot;_blank&quot;&quot;&gt;Find WiFi Hotspots around Lewes station&lt;/a&gt;&lt;/p&gt;","Y",,"N","N",,"N",,"N",,"N","Photo booth, station bookshop, and a&nbsp;dry cleaners&nbsp;","Y",,,,,,"Y","Y","<P>Quickfare machines are not low level and have non-compliant user-operated parts.</P>","Y","<p>Passengers unable to use high level windows may request assistance from Southern Assisted Travel on 08451 23 77 70.</p>","Y","Y","<p>Accessible taxis to/from this station to/from the nearest accessible station can be arranged through Southern Assisted Travel - 08451 23 77 70. For other taxi journeys, contact local taxi companies, details of which can be found at www.traintaxi.co.uk.</p>",,,"Y","Located by the&nbsp;ramp on Platform&nbsp;2 &amp;&nbsp;3&nbsp;","<P>Step-free access from main entrance to ticket office. Passenger-operated lift access to platforms 1,4 and 5. Steep ramp access to platforms 2 and 3 (to London / Seaford / Eastbourne).</P>","Y",,,,"Y",,"Y",94,"No","Y","Platforms 1 and 3, and outside the car park by platform 1",,"Stands, Wheel Racks","<p>Outside station on Station Road.</p>",,"<p>Information on taxis from this station is available at www.traintaxi.co.uk</p>","<p>Information to plan your onward journey is available in a printable format <a href=""""http://www.nationalrail.co.uk/posters/LWS.pdf"""">here</a></p>",,,,,,,"SN",,"965F31322110413D8F68ABB123AA2217"
"LFD","Lingfield","CRaan","21/03/2014",536900,"LINGFIELD","Station Road","Lingfield","Surrey",,,"RH7 6EF",-0.007158941,51.17644755,"SN","partTime","Y",,,"Announcements, ArrivalScreens","<P>Located on both platforms.</P>","Y",,"Y","<p>Located in the booking hall</p>","TicketMachine","Y","N","N","NotAvailable","N",,"N","Y","TicketMachine","Y","Southern's smartcard is called 'the key'.&nbsp; To apply online go to <A href=""http://www.southernrailway.com/thekey"">www.southernrailway.com/thekey</A> or pick up an application form from a Southern ticket office.",,"Applicable Operators: Southern","SN",,"N",,,,,,"N",,,,,,,"N",,,,"N","Y",,,"Y",,"N","Coffee shop","Y","Y",,"Y","Female toilets","N","Y","CardsAndCoins","&lt;p&gt;&lt;a href=&quot;&quot;http://btopenzone.hotspot-directory.com/results.php?txtQuick=RH7 6EF&amp;z=9&amp;radRoaming=1&quot;&quot; target=&quot;&quot;_blank&quot;&quot;&gt;Find WiFi Hotspots around Lingfield station&lt;/a&gt;&lt;/p&gt;","N",,"N","Y","Located outside the ticket office&nbsp;","N",,"N",,"N",,"N",,,,,,"Y","Y","<P>Located by the main entrance to station.</P>","Y",,"Y","N","<p>Accessible taxis to/from this station to/from the nearest accessible station can be arranged through Southern Assisted Travel - 0800 1381016. For other taxi journeys, contact local taxi companies, details of which can be found at www.traintaxi.co.uk.</p>",,"Nearest step-free station is Hurst Green.&nbsp;","N",,"<P>Partially Step Free.&nbsp; <BR>Step free access to Ticket Office and platform 1 (to London). Steps via footbridge to platform 2 (to East Grinstead). </P>","Y",,,"<P>In car park</P>","Y",,"N",40,"Yes","Y","station front",,"Stands","<p>Along from station on Station Road.</p>",,"<p>Information on taxis from this station is available at www.traintaxi.co.uk</p>","<p>Information to plan your onward journey is available in a printable format <a href=""""http://www.nationalrail.co.uk/posters/LFD.pdf"""">here</a></p>",,,,,,,"SN",,"6701B54A176E443FA08CBBBABC965EBB"
