"PMP","Plumpton","CPancutt","04/12/2013",533200,"PLUMPTON","Station Close","Plumpton Green",,,,"BN7 3BW",-0.060178055,50.9286601,"SN","partTime","Y",,,"DepartureScreens, Announcements","<p>Automated help points located on each platform</p>","Y",,"Y","<p>Located on Platform 2</p>","TicketMachine","Y","N","N","NotAvailable","N",,"N","Y","TicketOffice, TicketMachine","Y","Southern's smartcard is called&nbsp;'the key'.&nbsp; To apply online go to <A href=""http://www.southernrailway.com/thekey"">www.southernrailway.com/thekey</A> or&nbsp;pick up an application form from a Southern ticket office&nbsp;",,,,,"N","<p>Please contact Customer Services on 08451 272920.</p>",,,,,"N",,,,,,,"N",,,,"N","Y",,,"Y",,"N",,"N","N",,"N",,"N","Y","CardsAndCoins","&lt;p&gt;&lt;a href=&quot;&quot;http://btopenzone.hotspot-directory.com/results.php?txtQuick=BN7 3BW&amp;z=9&amp;radRoaming=1&quot;&quot; target=&quot;&quot;_blank&quot;&quot;&gt;Find WiFi Hotspots around Plumpton station&lt;/a&gt;&lt;/p&gt;","N",,"N","N",,"N",,"N",,"N",,"N",,,,,,"Y","Y","<p>Ticket machine is available on Platform 2</p>","Y",,"N","Y","<p>Accessible taxis to/from this station to/from the nearest accessible station can be arranged through Southern Assisted Travel - 0800 138 1016. For other taxi journeys, contact local taxi companies, details of which can be found at www.traintaxi.co.uk.</p>",,"<p>The nearest station(s) with more facilities than Plumpton are:</p> <ul> <li>Burgess Hill</li> </ul>","N",,"Step-free access to Platform 2 (to Lewes) via side gate and short, steep ramp.&nbsp; Step-free access to Platform 1 (to London) via level crossing and side entrance.&nbsp; Step-free access from Platform 1 to racecourse via short steep ramp and tarmac path.","Y",,,"<p>In Car Park</p>","Y",,"N",24,"Yes","Y","At the front of the station",,"Stands","<p>Outside station on Station Close.</p>",,"<p>Information on taxis from this station is available at www.traintaxi.co.uk</p>","<p>Information to plan your onward journey is available in a printable format <a href=""""http://www.nationalrail.co.uk/posters/PMP.pdf"""">here</a></p>",,,,,,,"SN",,"BC5C577154604AE4A4995524D55881B9"
"PLG","Polegate","CRaan","21/03/2014",545500,"POLEGATE","High Street","Polegate","East Sussex",,,"BN26 6EH",0.245732124,50.82121828,"SN","partTime","Y",,,"DepartureScreens, Announcements","<P>Located at the bottom of stairs on Platform 1, and also on Platform 2.</P>","Y",,"Y","<p>Located in the booking hall</p>","TicketMachine","Y","N","N","NotAvailable","N",,"N","Y","TicketOffice, TicketMachine","Y","Southern's smartcard is called 'the key'.  To apply online go to <a href=""http://www.southernrailway.com/thekey"">www.southernrailway.com/thekey</a> or pick up an application form from a Southern ticket office.",,,,,"N","<p><strong>Cycle restrictions on Southern trains from this station<br/></strong>0550 to London Bridge - cycles cannot be carried beyond Lewes<br/>0633 to London Bridge - cycles cannot be carried beyond Lewes<br/>0705 to Victoria - cycles cannot be carried beyond Lewes<br/>0723 to London Bridge - cycles cannot be carried beyond Lewes<br/>0739 to Victoria - cycles cannot be carried beyond Lewes<br/>0754 to Brighton - cycles cannot be carried at all on this train<br/>0805 to Victoria - cycles cannot be carried beyond Lewes<br/>0812 to Brighton - cycles cannot be carried at all on this train<br/>0825 to Victoria - cycles cannot be carried at all on this train<br/>0852 to Brighton - cycles cannot be carried at all on this train<br/>1657 to Ashford International - cycles cannot be carried at all on this train<br/>1725 to Ore - cycles cannot be carried at all on this train<br/>1757 to Ashford International - cycles cannot be carried at all on this train<br/>1858 to Ashford International - cycles cannot be carried at all on this train</p> <p>Please visit <a href=""""http://www.southernrailway.com/cyclepolicy"""">www.southernrailway.com/cyclepolicy</a> for more information</p>",,,,,"N",,,,,,,"N",,,,"N","Y",,,"Y",,"N",,"N","N",,"N",,"N","Y","CardsAndCoins","&lt;p&gt;&lt;a href=&quot;&quot;http://btopenzone.hotspot-directory.com/results.php?txtQuick=BN26 6EH&amp;z=9&amp;radRoaming=1&quot;&quot; target=&quot;&quot;_blank&quot;&quot;&gt;Find WiFi Hotspots around Polegate station&lt;/a&gt;&lt;/p&gt;","N",,"N","N",,"N",,"N",,"N","News agent","Y",,,,,,"Y","Y","Ticket machines are available on both platforms &nbsp;","Y",,"N","Y","<p>Accessible taxis to/from this station to/from the nearest accessible station can be arranged through Southern Assisted Travel - 0800 138 1016. For other taxi journeys, contact local taxi companies, details of which can be found at www.traintaxi.co.uk.</p>",,,"N",,"<P>Step-free access to each platform via short steep ramps. Step-free interchange between platforms via level crossing. </P>","Y",,,"<P>Located in car park</P>","Y",,"N",22,"No","Y","station front",,"Stands, Wheel Racks","<p>Outside station on The Centre.</p>",,"<p>Information on taxis from this station is available at www.traintaxi.co.uk</p>","<p>Information to plan your onward journey is available in a printable format <a href=""""http://www.nationalrail.co.uk/posters/PLG.pdf"""">here</a></p>",,,,,,,"SN",,"A7969F475CF146E4B89301DAD9BB700F"
"PLD","Portslade","CRaan","21/03/2014",527600,"PORTSLADE.","Portland Road","Hove",,,,"BN3 5SG",-0.205323859,50.83567693,"SN","partTime","Y",,,"Announcements, ArrivalScreens","<P>Located on platform 1/2.</P>","Y",,"Y","<p>Located on the platform<br/></p>","TicketMachine","Y","N","N","NotAvailable","N",,"N","Y","TicketMachine","Y","Southern's smartcard is called 'the&nbsp;key'.&nbsp; To apply online go to <A href=""http://www.southernrailway.com/thekey"">www.southernrailway.com/thekey</A> or&nbsp;pick up an application form from a Southern ticket office.&nbsp;",,,,,"N","<p> <p><strong>Cycle restrictions on Southern trains from this station</strong></p> <p>0553 to Victoria - cycles cannot be carried beyond Hove<br/>0627 to London Bridge - cycles cannot be carried beyond Hove<br/>0706 to London Bridge - cycles cannot be carried beyond Hove<br/>0717 to Victoria - cycles cannot be carried beyond Hove<br/>0736 to Victoria - cycles cannot be carried beyond Hove<br/>0752 to Brighton - cycles cannot be carried at all on this train<br/>0759 to Brighton - cycles cannot be carried at all on this train<br/>0804 to Victoria - cycles cannot be carried beyond Hove<br/>0822 to Brighton - cycles cannot be carried at all on this train<br/>0831 to Brighton - cycles cannot be carried at all on this train<br/>0839 to Brighton - cycles cannot be carried at all on this train<br/>0848 to Victoria - cycles cannot be carried beyond Hove<br/>0859 to Brighton - cycles cannot be carried at all on this train<br/>0911 to Brighton - cycles cannot be carried at all on this train<br/>1640 to Southampton Central - cycles cannot be carried on this train<br/>1710 to Portsmouth Harbour - cycles cannot be carried on this train<br/>1731 to Littlehampton - cycles cannot be carried on this train<br/>1740 to Southampton Central - cycles cannot be carried on this train<br/>1753 to Littlehampton - cycles cannot be carried on this train<br/>1808 to Portsmouth Harbour - cycles cannot be carried on this train<br/>1836 to Southampton Central - cycles cannot be carried on this train</p> <p>Please visit <a href=""""http://www.southernrailway.com/your-journey/cycle-policy/"""" target=""""_blank"""">www.southernrailway.com/cyclepolicy</a> for more information</p> </p>",,,,,"N",,,,,,,"N",,,,"N","Y",,,"N",,"N",,"N","N",,"N",,"N","N",,"&lt;p&gt;&lt;a href=&quot;&quot;http://btopenzone.hotspot-directory.com/results.php?txtQuick=BN3 5SG&amp;z=9&amp;radRoaming=1&quot;&quot; target=&quot;&quot;_blank&quot;&quot;&gt;Find WiFi Hotspots around Portslade station&lt;/a&gt;&lt;/p&gt;","N",,"N","N",,"N",,"N",,"N",,"N",,,,,,"Y","Y","<p>Quickfare machine can be located on platform 1 .</p>","N",,"N","Y","<p>Accessible taxis to/from this station to/from the nearest accessible station can be arranged through Southern Assisted Travel - 0800 138 1016For other taxi journeys, contact local taxi companies, details of which can be found at www.traintaxi.co.uk.</p>",,,"N",,"<P>Step-free access to each platform via short steep ramps.&nbsp; Step-free interchangeg between platforms via level crossing. </P>","Y",,,"<p>Area cobbled</p>","Y",,"Y",7,"Yes","Y","Platform 1",,,"<p>Outside station at existing bus stops on Portland Road.</p>",,"<p>Information on taxis from this station is available at www.traintaxi.co.uk</p>","<p>Information to plan your onward journey is available in a printable format <a href=""""http://www.nationalrail.co.uk/posters/PLD.pdf"""">here</a></p>",,,,,,,"SN",,"A64363216C5446C89E70C3396DAD55D2"
"PRP","Preston Park","CShepherd","05/03/2014",528500,"PRESTON PARK","Clermont Road","Preston Park","Brighton","East Sussex",,"BN1 6SG",-0.155167744,50.84593878,"SN","partTime","Y","Yes - from help point, Yes - from ticket office",,"DepartureScreens, Announcements",,"Y",,"Y","<p>Located in the booking hall</p>","TicketMachine","Y","N","N","NotAvailable","N",,"N","Y","TicketOffice, TicketMachine","Y","<p>Southerns smart card is called the key, you can apply at <a href=""http://www.southernrailway.com/thekey"">www.southernrailway.com/thekey</a> or pick up a form from a southern ticket office</p>",,,,,"N","<p>Please call the Customer services on 08451 272 920</p>",,,,,"N",,,,,,,"N","Please call the Customer services on 08451 272 920",,,"N","Y",,,"Y","<p>Platform 1/2 - there is a roof with seats underneath </p> <p>Platform 3 - Shelter with no seats, seats on platform </p> <p>&nbsp;</p>","N","Coffee shop","Y","Y",,"Y",,"N","N",,"&lt;p&gt;&lt;a href=&quot;&quot;http://btopenzone.hotspot-directory.com/results.php?txtQuick=BN1 6SG&amp;z=9&amp;radRoaming=1&quot;&quot; target=&quot;&quot;_blank&quot;&quot;&gt;Find WiFi Hotspots around Preston Park station&lt;/a&gt;&lt;/p&gt;","Y",,"N","N",,"N",,"N",,"N",,"N","<p>Please call the Assisted travel team on 0800 138 1016</p>","Please call the Assisted travel team on 0800 138 1016",,,,"Y","Y","<p>Quickfare machine can be located top of stairs on platform 1&2 .</p>","Y",,"N","N","<p>Accessible taxis to/from this station to/from the nearest accessible station can be arranged through Southern Assisted Travel - 0800 138 1016. For other taxi journeys, contact local taxi companies, details of which can be found at www.traintaxi.co.uk.</p>",,"<p>Brighton </p>","N",,"<p>No step-free access to Ticket Office or platforms. Nearest step-free station is Brighton.</p>","N",,,,"N",,"N",0,"No","Y",,,,"<p>Along from station at existing bus stops on A23 London Road.</p>",,"<p>Information on taxis from this station is available at www.traintaxi.co.uk</p>","<p>Information to plan your onward journey is available in a printable format <a href=""""http://www.nationalrail.co.uk/posters/PRP.pdf"""">here</a></p>",,,,,,,"SN",,"0D2DEE1A6C684C5CB390588D202E1D46"
"PUL","Pulborough","CRaan","21/03/2014",546800,"PULBOROUGH","Station Approach","Pulborough","West Sussex",,,"RH20 1AH",-0.516553376,50.95734852,"SN","partTime","Y","Yes - from help point, Yes - from ticket office",,"DepartureScreens, Announcements",,"Y",,"Y","<p>Located in the booking hall</p>","TicketMachine","Y","N","N","NotAvailable","N",,"N","N","NotAvailable","Y","<p>Southerns smart card is called the key, you can apply at <a href=""http://www.southernrailway.com/thekey"">www.southernrailway.com/thekey</a> or pick up a form from a southern ticket office</p>",,,,,"N","<p><strong>Please call Customer services on 08451 272 920</strong></p> <p><strong>Cycle restrictions on Southern trains from this station</strong></p> <p>0606 to London Victoria - cycles cannot be carried beyond Horsham<br /> 0632 to London Victoria - cycles cannot be carried beyond Horsham<br /> 0707 to London Victoria - cycles cannot be carried beyond Horsham<br /> 0728 to London Bridge - cycles cannot be carried beyond Horsham<br /> 0742 to London Victoria - cycles cannot be carried beyond Horsham<br /> 0822 to London Victoria - cycles cannot be carried beyond Horsham</p> <p>Please visit <a href="""">www.southernrailway.com/cyclepolicy</a> for more information.</p> <p> </p>",,,,,"N",,,,,,,"N","Please call Customer services on 08451 272 920",,,"N","Y",,"Available during staffed hours","Y","<p>Seating can be located on each platform </p> <p>Waiting room can be located on platform 1 </p>","N","Coffee kiosk","Y","Y",,"Y",,"N","Y","CardsAndCoins","&lt;p&gt;&lt;a href=&quot;&quot;http://btopenzone.hotspot-directory.com/results.php?txtQuick=RH20 1AH&amp;z=9&amp;radRoaming=1&quot;&quot; target=&quot;&quot;_blank&quot;&quot;&gt;Find WiFi Hotspots around Pulborough station&lt;/a&gt;&lt;/p&gt;","N",,"N","N",,"N",,"N",,"N",,"N","<p>Please call the Assisted travel team on 0800 138 1016</p>","Please call the Assisted travel team on 0800 138 1016",,,,"Y","Y","<p>Quickfare machine can be located in the car park .</p>","Y",,"N","Y","<p>Accessible taxis to/from this station to/from the nearest accessible station can be arranged through Southern Assisted Travel - 08001381016. taxi journeys, contact local taxi companies, details of which can be found at www.traintaxi.co.uk.</p>",,,"N","<p>Key needs to be picked up from station staff for  Accessible toilet this can be located on concourse with female toilet . Male toilet can be located on platform 2 . </p> <p> </p>","<p>Step-free access via side entrance and short steep ramp to platform 2 (to the coast). Steps to main entrance and Ticket Office, although alternative step-free access available via platform 2. Subway with steps to platform 1 (to London). Nearest step-free station is Billingshurst or Horsham.</p>","N",,,,"Y",,"N",12,"No","Y","station front",,,"<p>Station forecourt.</p>",,"<p>Information on taxis from this station is available at www.traintaxi.co.uk</p>","<p>Information to plan your onward journey is available in a printable format <a href=""""http://www.nationalrail.co.uk/posters/PUL.pdf"""">here</a></p>",,,,,,,"SN",,"9A1A7E86522249D18242412E179AB54C"
"PUR","Purley","CRaan","21/03/2014",537900,"PURLEY","Station Approach","Whytecliffe Road","Purley","Greater London",,"CR8 2UD",-0.113608701,51.33739162,"SN","fullTime","Y","Yes - from information point, Yes - from ticket office",,"DepartureScreens, Announcements","<p>Platform staff offices on platforms 4/5 and 6.. Station managers office on platform 2/3. Help points white in colour can be located on platform 3 & between platform 4&5 .</p>","Y",,"Y",,"TicketMachine","Y","Y","Y","TicketMachine","Y",,"N","N","NotAvailable","N",,"Zone 6",,,,"Y","<p>Please call Customer services on 08451 272 920</p>",,,,,"N",,,,,,,"N","Please call Customer services on 08451 272 920",,,"N","Y",,,"Y","<p>Waiting rooms on platform 2/3 4/5 with space for wheelchairs. Waiting room on platform 6 with one small step to access.</p> <p>Seating available on platforms 3,4,5,6</p>","N",,"N","Y",,"Y",,"N","N",,"&lt;p&gt;&lt;a href=&quot;&quot;http://btopenzone.hotspot-directory.com/results.php?txtQuick=CR8 2UD&amp;z=9&amp;radRoaming=1&quot;&quot; target=&quot;&quot;_blank&quot;&quot;&gt;Find WiFi Hotspots around Purley station&lt;/a&gt;&lt;/p&gt;","N",,"N","N",,"N",,"Y",,"N",,"N","<p>Please call the Assisted travel team on 0800 138 1016</p>","Please call the Assisted travel team on 0800 138 1016",,,,"Y","Y","<p>2 quick fare machines can be located by main entrance to station .</p>","Y",,"Y","Y","<p>Contact local taxi companies, details of which can be found at www.traintaxi.co.uk.</p>",,,"N","<p>Keys can be located from station staff .</p>","<p>Step-free access to Main Entrance and Ticket Office. Step-free access via lifts to all platforms. Rear entrance to station also has step-free access to platform 6 (for trains to Caterham/Tattenham Corner).</p>","Y",,,,"Y",,"Y",10,"Yes","Y","Station front",,"Stands","<p>Outside station on Station Approach (adjacent to Platform 6).</p>",,"<p>Information on taxis from this station is available at www.traintaxi.co.uk</p>","<p>Information to plan your onward journey is available in a printable format <a href=""""http://www.nationalrail.co.uk/posters/PUR.pdf"""">here</a></p>",,,,,,,"SN",,"7F1EA0E7D6804350B552597BB3CED9C5"
"PUO","Purley Oaks","CRaan","21/03/2014",543000,"PURLEY OAKS","Brantwood Road","South Croydon","Greater London",,,"CR2 0ND",-0.098851969,51.34704533,"SN","fullTime","Y",,,"DepartureScreens, Announcements","<P>Located at top of stairs.</P>","Y",,"Y","<P>Located in the booking hall</P>","TicketMachine","Y","N","Y","TicketMachine","Y","Oyster cards with a pre-loaded deposit only are available from ticket office. Top-up only from self-service ticket machine(s).","N","N","NotAvailable","N",,"Zone 6",,,,"Y",,,,,,"N",,,,,,,"N",,,,"N","Y",,,"Y","Located on Platform 3","N",,"N","Y","Male and female toilets both&nbsp;located on Platform 3","Y",,"N","N","CardsAndCoins","<p><a href=""http://btopenzone.hotspot-directory.com/results.php?txtQuick=CR2 0ND&amp;z=9&amp;radRoaming=1"" target=""_blank"">Find WiFi Hotspots around Purley Oaks station</a></p>","N",,"N","N",,"N",,"N",,"N",,"N",,,,,,"Y","Y","<P>Located in the station subway.</P>","Y",,"N","Y","<p>Accessible taxis to/from this station to/from the nearest accessible station can be arranged through Southern Assisted Travel - 08001381016. For other taxi journeys, contact local taxi companies, details of which can be found at www.traintaxi.co.uk.</p>",,,"N",,"<p>No step-free access to Ticket Office and platforms. Nearest step-free station is Purley.</p>","N",,,"<p>In Car Park</p>","Y",,"N",10,"Yes","Y","station front",,,"<p>Along from station on A23 Brighton Road.</p>",,"<p>Information on taxis from this station is available at www.traintaxi.co.uk</p>","<p>Information to plan your onward journey is available in a printable format <a href=""""http://www.nationalrail.co.uk/posters/PUO.pdf"""">here</a></p>",,,,,,,"SN",,"2552011145FE4CB19C72C3C88D5206FD"
"QRP","Queens Road (Peckham)","CPancutt","05/12/2013",542400,"QUEENS RD PECKHM","Rail Station","Queens Road","Peckham","London",,"SE15 2JR",-0.057574233,51.47406855,"SN","fullTime","Y",,,"DepartureScreens, Announcements, ArrivalScreens","<P>Located on Platform 2.</P>","Y",,"Y","<P>Located in the booking hall</P>","TicketMachine","Y","N","Y","TicketMachine","Y",,"N","N","NotAvailable","N",,"Zone 2",,,,"Y",,,,,,"N",,,,,,,"N",,,,"N","Y",,,"N",,"N",,"N","N",,"N",,"N","Y","CardsAndCoins","&lt;p&gt;&lt;a href=&quot;&quot;http://btopenzone.hotspot-directory.com/results.php?txtQuick=SE15 2JR&amp;z=9&amp;radRoaming=1&quot;&quot; target=&quot;&quot;_blank&quot;&quot;&gt;Find WiFi Hotspots around Queens Road, Peckham station&lt;/a&gt;&lt;/p&gt;","N",,"N","N",,"N",,"N",,"N",,"N",,,,,,"Y","Y","<p>Quickfare machine can be located at entrance to station before going up to platforms ..</p>","Y",,"Y","N","<p>Accessible taxis to/from this station to/from the nearest accessible station can be arranged through Southern Assisted Travel - 08001381016 for other taxi journeys, contact local taxi companies, details of which can be found at www.traintaxi.co.uk.</p>",,,"N",,"<p>No step-free access to Ticket Office and platforms. Step-free interchange available between platforms. Nearest step-free station is London Bridge.</p>","N",,,,"N",,"N",6,"No","Y","station front",,"Stands","<p>Outside station at existing bus stops on A202 Queens Road.</p>",,"<p>Information on taxis from this station is available at www.traintaxi.co.uk</p>","<p>Information to plan your onward journey is available in a printable format <a href=""""http://www.nationalrail.co.uk/posters/QRP.pdf"""">here</a></p>",,,,,,,"SN",,"3CCF16CDB1F24405BFFC8CF09E2340DE"
"RDH","Redhill","CRaan","20/03/2014",547800,"REDHILL","Redstone Hill","Redhill","Surrey",,,"RH1 1RB",-0.165898311,51.24019809,"SN","fullTime","Y",,,"DepartureScreens, Announcements",,"Y",,"Y","<p>Located in the booking hall</p>","TicketMachine","Y","N","N","NotAvailable","N",,"N","Y","TicketOffice, TicketMachine","Y","Southern's smartcard is called 'the key'.&nbsp; To apply online go to <A href=""http://www.southernrailway.com/thekey"">www.southernrailway.com/thekey</A> or pick up an application form from a Southern ticket office.",,,,,"N","<p>Call Customer Services 08451 272920</p>",,,,,"N",,,,,,,"N",,,,"N","Y",,,"Y","Located on Platform 1 and 2 - seating along the platform; seating with roof on Platform 3; waiting room has sofa","N","Coffee kiosk","Y","Y",,"Y",,"N","Y","CardsAndCoins","<p><a href=""http://btopenzone.hotspot-directory.com/results.php?txtQuick=RH1 1RB&amp;z=9&amp;radRoaming=1"" target=""_blank"">Find WiFi Hotspots around Redhill station</a></p>","Y",,"N","N",,"N",,"N",,"N",,"N",,,,,,"Y","Y",,"Y","<p>Passengers unable to use high level windows may request assistance from Southern Assisted Travel on 08451 23 77 70.</p>","N","Y","<p>Please contact local taxi companies, details of which can be found at www.traintaxi.co.uk.</p>",,,"N","<p>Accessible toilet facilities are available at this station</p>","<p>Level access to platform 3 from rear entrance to the station.  Step free access via lifts to platforms 1 & 2.  Step free access from Booking Hall to platforms is via street and rear entrance only. </p>","Y",,,"<p>In Car Park</p>","Y",,"Y",120,"Yes","Y","Two-tier cycle storage at station front",,"Stands","<p>Station Forecourt.</p>",,"<p>Information on taxis from this station is available at www.traintaxi.co.uk</p>","<p>Information to plan your onward journey is available in a printable format&nbsp;<a href=""http://www.nationalrail.co.uk/posters/RDH.pdf"">here</a></p>",,,,,,"The lift renewal at Redhill is now complete.  A new lift will also be opening by the begining of June from the main ticket office to the existing lifts.   Please use the rear entrance of the station for step free access until the new lift is open.","SN",,"8ADF56DD370A43BDACAA5EECE04AFE12"
"RHM","Reedham (Surrey)","kmonk","02/12/2013",543100,"REEDHAM LONDON","Old Lodge Lane","Purley","Surrey",,,"CR8 4DJ",-0.12387235,51.33216069,"SN","partTime","Y","Yes - from help point, Yes - from ticket office",,"Announcements, ArrivalScreens",,"Y",,"Y","<p>Located in the booking hall</p>","TicketMachine","Y","N","Y","TicketMachine","Y",,"N","N","NotAvailable","N",,"Zone 6",,,,"Y","<p>Please call customer services on 08451 272 920</p>",,,,,"N",,,,,,,"N","Please call customer services on 08451 272 920",,,"N","Y",,,"N","<p>Seating can be found on both platforms </p>","N",,"N","N",,"N",,"N","N",,"&lt;p&gt;&lt;a href=&quot;&quot;http://btopenzone.hotspot-directory.com/results.php?txtQuick=CR8 4DJ&amp;z=9&amp;radRoaming=1&quot;&quot; target=&quot;&quot;_blank&quot;&quot;&gt;Find WiFi Hotspots around Reedham (Surrey) station&lt;/a&gt;&lt;/p&gt;","N",,"N","N",,"N",,"N",,"N",,"N",,"Please call the Assisted travel team on 0800 138 1016",,,,"Y","Y","<p>Quickfare machine can be located on platform 2 .</p>","Y","<p><br/></p>","N","N","<p>Accessible taxis to/from this station to/from the nearest accessible station can be arranged through Southern Assisted Travel - 08001381016 or other taxi journeys, contact local taxi companies, details of which can be found at www.traintaxi.co.uk.</p>",,"<p>Coulsdon town </p>","N",,"<p>Step free access to Ticket Office and platform 2 (to Tattenham Corner) only. No step-free access to platform 1 (to London). Nearest step-free station is Purley.</p>","N",,,,"N",,"N",0,"No","Y","<p>Located on platform 2 </p>",,"Wheel Racks","<p>Outside station on A23 Brighton Road.</p>",,"<p>Information on taxis from this station is available at www.traintaxi.co.uk</p>","<p>Information to plan your onward journey is available in a printable format <a href=""""http://www.nationalrail.co.uk/posters/RHM.pdf"""">here</a></p>",,,,,,,"SN",,"647346127022443580DC9D76EA31B9FB"
