"EUS","London Euston","SPimperton","13/03/2014",144400,"LONDON EUSTON","Euston Road","London","Greater London",,,"NW1 2RT",-0.134558479,51.52837626,"NR","fullTime","Y",,,"DepartureScreens, Announcements, ArrivalScreens","<p>A dedicated Mobility Assistance Reception is located on the main concourse adjacent to the ticket office. There is also a Customer Information Point located in the centre of the concourse.</p><p><span class=""""ophr"""" style=""""font: 12px/normal Arial, Helvetica, sans-serif; text-align: left; text-transform: none; text-indent: 0px; letter-spacing: normal; word-spacing: 0px; white-space: normal; font-size-adjust: none; font-stretch: normal; -webkit-text-stroke-width: 0px;"""">Monday-Saturday 07:00-23:00</span><br style=""""font: 12px/normal Arial, Helvetica, sans-serif; text-align: left; text-transform: none; text-indent: 0px; letter-spacing: normal; word-spacing: 0px; white-space: normal; font-size-adjust: none; font-stretch: normal; -webkit-text-stroke-width: 0px;""""><span class=""""ophr"""" style=""""font: 12px/normal Arial, Helvetica, sans-serif; text-align: left; text-transform: none; text-indent: 0px; letter-spacing: normal; word-spacing: 0px; white-space: normal; font-size-adjust: none; font-stretch: normal; -webkit-text-stroke-width: 0px;"""">Sunday 08:00-23:00</span></p>","Y",,"Y","<p style=""font: 12px/1.4em Arial, Helvetica, sans-serif; margin: 0px; padding: 0px 0px 1em; text-align: left; text-transform: none; text-indent: 0px; letter-spacing: normal; word-spacing: 0px; white-space: normal; font-size-adjust: none; font-stretch: normal; -webkit-text-stroke-width: 0px;"">The&nbsp;travel centre is on the left&nbsp;as you enter&nbsp;through&nbsp;the main entrance.</p><p style=""font: 12px/1.4em Arial, Helvetica, sans-serif; margin: 0px; padding: 0px 0px 1em; text-align: left; text-transform: none; text-indent: 0px; letter-spacing: normal; word-spacing: 0px; white-space: normal; font-size-adjust: none; font-stretch: normal; -webkit-text-stroke-width: 0px;"">Advanced bookings are available Monday to Sunday - 07:30 to 21:00</p>","TicketMachine","Y","N","Y","TicketMachine","Y","Oyster PAYG top-up avaialble from the London Midland ticket office adjacent to Platforms 8-11. Other Oyster transactions avaialble from service ticket machines operated by London Midland.","N","N","NotAvailable","N",,"Zone 1","Applicable Operators: London Midland, London Overground","LM, LO",,"Y","<span class=""""ophr"""" style=""""font: 12px/normal Arial, Helvetica, sans-serif; text-align: left; text-transform: none; text-indent: 0px; letter-spacing: normal; word-spacing: 0px; white-space: normal; font-size-adjust: none; font-stretch: normal; -webkit-text-stroke-width: 0px;"""">Monday-Sunday 07:00-23:00</span><span style=""""font: 12px/normal Arial, Helvetica, sans-serif; text-align: left; text-transform: none; text-indent: 0px; letter-spacing: normal; word-spacing: 0px; float: none; display: inline !important; white-space: normal; font-size-adjust: none; font-stretch: normal; -webkit-text-stroke-width: 0px;""""><span class=""""Apple-converted-space""""> </span></span><br style=""""font: 12px/normal Arial, Helvetica, sans-serif; text-align: left; text-transform: none; text-indent: 0px; letter-spacing: normal; word-spacing: 0px; white-space: normal; font-size-adjust: none; font-stretch: normal; -webkit-text-stroke-width: 0px;""""><p style=""""font: 12px/1.4em Arial, Helvetica, sans-serif; margin: 0px; padding: 0px 0px 1em; text-align: left; text-transform: none; text-indent: 0px; letter-spacing: normal; word-spacing: 0px; white-space: normal; font-size-adjust: none; font-stretch: normal; -webkit-text-stroke-width: 0px;"""">Available from the Customer Information Point in the centre of the concourse. Alternatively customers can seek information and assitance from the ticket office or the Mobility Assistance Reception.</p>",,"0207 387 1499",,"http://www.left-baggage.co.uk/locations.php","Y","Excess Baggage Company",,,,"http://www.lostproperty.org/locations.php",,"Y","Excess Baggage Company","<p><strong>Located</strong></p> <p>Upstairs next to the Brittania Pub</p> <p><strong>Step free to access </strong></p> <p>Yes a platform for mobility impaired customers.</p> <p><strong>Refreshments</strong></p> <p>First Class customers can find a comfy seat and enjoy complimentary soft drinks, light snacks and newspapers. A full bar is available at both locations for the purchase of alcoholic drinks</p> <p><strong>Tickets Accepted:</strong></p> <p>Virgin Business, First Open or Advance First tickets. ScotRail First tickets for the Caledonian Sleepers. You can only enter the lounge on the travel date shown on your ticket.</p> <p><strong>Concessions for Standard Class sleeper customers</strong></p> <p>No</p>",,"Y","N",,,"Y",,"Y","Coffee shop Caf&eacute; Coffee kiosk Food vending machine Public House/Bar Food outlet (Seating available) Food outlet (Seating unavailable)","Y","Y","These are located adjacent to the main public toilets, by the entrance to platforms 1-3","Y",,"N","Y","CardsAndCoins","&lt;p&gt;Find WiFi Hotspots around London Euston station&lt;/p&gt;","Y",,"N","Y","Located on the concourse","Y",,"Y","Located outside the station Located on concourse Located outside main entrance","Y","Shoe repairer Wide range of shops Pharmacy Off Licence Passport Photo Booth","Y",,,,,,"Y","Y",,"Y",,"Y","Y","<p>The route to the main taxi pick up point has steps, so anyone with mobility problems can use the disabled taxi pick up point reached via the lifts.</p> <p>You can request assistance to and from the taxi rank can using the telephones at the top of the stairs and at the taxi set down point.</p> <p>The main taxi rank is beneath the station and is reached via the lifts next to the main ticket office or the stairs by the entrance to the Underground.</p>",,,"N","<p>These are loacted adjacent to the main public toilets, by the entrance to platforms 1-3.</p>","<span style=""""font: 12px/17.01px Arial, Helvetica, sans-serif; text-align: left; text-transform: none; text-indent: 0px; letter-spacing: normal; word-spacing: 0px; float: none; display: inline !important; white-space: normal; font-size-adjust: none; font-stretch: normal; -webkit-text-stroke-width: 0px;"""">Suitable for disabled passengers. Level access to all platforms. Lifts provided between concourse, taxi and London Underground ticket hall.</span>","Y","There are ticket gates at the entrances to platforms 8 - 11 inclusive.","Y","<p>Assistance is available to and from platforms, the car park and the taxi rank. You can request this from the Mobility Assistance Reception on the main concourse or from any member of staff. To book assitance in advance please use the following numbers:</p> <ul> <li>Virgin Trains - <strong>0845 744 3366</strong>, textphone <strong>18001 0800 912 2901</strong> </li> <li>London Midland - <strong>0800 092 4260</strong>, textphone <strong>0844 811 0134</strong> </li> <li>London Overground - <strong>0845 6014 867</strong> </li> <li>ScotRail - <strong>0800 912 2901</strong>, textphone <strong>18001 0800 912 2901</strong></li> </ul>","Y",,"Y",275,"Yes","Y","Behind Nandos & Cafe Rouge on the Piazza. On the West and East Colonnades",,"Stands",,,"<p>The taxi rank is located beneath the station.</p>","<p>Bus route maps are available from <a href=""""http://Bus route maps are available from Transport for London's website"""">Transport for London's website</a></p>","<p>Euston Underground station has access to the Northern Line and the Victoria Line.  Nearby Euston Square station has access to the Circle, Hammersmith & City and Metropolitan Lines.</p>",,,"Car hireThere is a branch of <a href=""""http://www.europcar.co.uk/"""" title=""""EuropCar"""" target=""""_blank"""">EuropCar</a> on the 1st floor of the car park; <a href=""""http://www.streetcar.co.uk/"""" title=""""StreetCar"""" target=""""_blank"""">StreetCar</a> and <a href=""""http://www.zipcar.com/"""" title=""""Zipcar"""" target=""""_blank"""">Zipcar</a> are by the car park exit.","<p>There are several Barclays Cycle Hire points located around Euston</p>","<p>For&#160;all&#160;Virgin Trains&#160;services, barriers&#160;will close 2 minutes prior to departure. Please note train doors close 1 minute prior to departure for all Virgin Trains &amp; London Midland services. Doors close 30 seconds before departure for London Overground services.&#160; </p>","NR",,"1A64E3F909D9444EACD5CB9AF584D3E4"
"KGX","London Kings Cross","SPimperton","04/03/2014",612100,"LONDON KINGS X","Kings Cross Station","Euston Road",,,,"N1 9AL",-0.122921342,51.53088842,"NR","fullTime","Y",,,,"<p>Customer Information Point is available on the main concourse. Customers arriving by car and requiring assistance (pre-booked only) will be met in the West Yard Entrance.</p>","Y",,"Y",,"TicketMachine","Y","N","Y","TicketMachine","Y","Oyster transactions only available from self service ticket machines operated by First Capital Connect","N","N","NotAvailable","N",,"Zone 1","Applicable Operators: First Capital Connect","FC",,"Y","<p>As per station opening hours, please contact Network Rail.</p>",,"020 7837 4334",,"http://www.left-baggage.co.uk/locations.php","Y","Excess Baggage Company",,"020 7278 3310",,"http://www.excess-baggage.com/lost_property/lost_property.php",,"Y","Excess Baggage Company","<p><strong>Located</strong></p> <p>The East Coast First Class Lounge is located on the Western concourse next to the Travel Centre.</p> <p><strong>Tickets Accepted</strong></p> <ul> <li>Fully inter-available First Class Season Ticket (ie tickets not specific to one train company) </li> <li>Any First Class Anytime ticket valid for travel on the East Coast route. </li> <li>Any East Coast First Class packages. </li> <li>Holders of a First Class Lounge supplement, available for purchase with a East Coast First Advance ticket or First Class reader offer. </li> </ul> <p><strong>Restricted tickets</strong></p> <ul> <li>All First&nbsp;Advance tickets (unless accompanied by a&nbsp;<a href=""http://www.nationalrail.co.uk/times_fares/prce44205e9a4730a3b6fe5973cdebbc.aspx"">First Class Lounge Upgrade</a>) </li> <li>All tickets with Weekend&nbsp;First supplements. </li> <li>All&nbsp;First Class tickets valid only on other train operators, including ScotRail Sleepers. </li> </ul> <p><strong>Facilities</strong></p> <p>Toilets/Fax/Printer/Meeting Rooms, TV, newspapers</p> <p><strong>Refreshments</strong></p> <ul> <li><em>Complimentary</em>: tea/coffee/hot chocolate/orange juice/water/ biscuits. </li> <li><em>Chargable:</em> Food and Drink from the on board menu. </li> </ul> <p><strong>Wi-Fi</strong></p> <p>Available</p> <p><strong>Showers</strong></p> <p>Not available</p>",,"Y","N",,,"N",,"Y",,"Y","Y",,"Y",,"Y","Y","CardsAndCoins","&lt;p&gt;&lt;a href=&quot;&quot;http://btopenzone.hotspot-directory.com/results.php?txtQuick=N1 9AP&amp;z=9&amp;radRoaming=1&quot;&quot; target=&quot;&quot;_blank&quot;&quot;&gt;Find WiFi Hotspots around London Kings Cross station&lt;/a&gt;&lt;/p&gt;","Y",,"N","N",,"N",,"Y",,"Y",,"Y",,,,"Available during station opening hours",,"Y","Y","<p>1 East Coast machine inside travel centre and 1 East Coast machine outside travel centre are DDA compliant</p>","Y",,"Y","Y","<p>Taxi rank outside main station entrance</p>","<p>Available during station opening hours on the main concourse</p>",,"N","<p>Available during station opening hours</p>","<p><span style=""""font: 12px/normal Arial, Helvetica, sans-serif; text-align: left; text-transform: none; text-indent: 0px; letter-spacing: normal; word-spacing: 0px; float: none; display: inline !important; white-space: normal; font-size-adjust: none; font-stretch: normal; -webkit-text-stroke-width: 0px;"""">All platforms. </span>Available during station opening hours</p>","N",,,,"Y",,"Y",332,"Yes","Y","West Yard opposite Platforms 9 - 11.","<p><br/></p>",,,,"<p>The taxi rank is situated on the west side of the station on Pancras Road. Most taxis are wheelchair accessible.</p>","<p>Available just outside the station.</p>","<p>n/a</p>","<p>Connections from LUL available</p>",,,,,"NR",,"03D24880231645C2A113E0740F5450BB"
"LST","London Liverpool Street","EBracey","31/12/2013",696500,"LONDON LIVRPL ST","Network Rail Station Reception","Bishopsgate","London","Greater London",,"EC2M 7PY",-0.081995697,51.51802304,"NR","fullTime","Y",,,"DepartureScreens, Announcements, ArrivalScreens","<p>The customer help point is located on the main concourse in front of the ticket office</p> <p> </p>","Y","Located on the main concourse","Y","<span style=""font: 12px/17.01px Arial, Helvetica, sans-serif; text-align: left; text-transform: none; text-indent: 0px; letter-spacing: normal; word-spacing: 0px; float: none; display: inline !important; white-space: normal; font-size-adjust: none; font-stretch: normal; -webkit-text-stroke-width: 0px;"">Located on the main concourse</span>","TicketMachine","Y","Y","Y","TicketMachine","Y",,"N","N","NotAvailable","N",,"Zone 1","Applicable Operators: c2c, Abellio Greater Anglia JL","CC, LE",,"Y","There is a customer services point at this station",,"0207 247 4297",,"http://www.left-baggage.co.uk/locations.php","Y","Excess Baggage Company",,,,"http://www.lostproperty.org/locations.php",,"Y","Excess Baggage Company","<p><strong>Located</strong></p> <p>Platform 10</p> <p><strong>Tickets Accepted</strong></p> <p>All First Class</p> <p> <p><strong>Facilities</strong></p> <p>Screens with updated train information</p> </p>",,"Y","Y",,,"Y",,"Y","Coffee shop Buffet Coffee kiosk Public House/Bar Food outlet (Seating available) Food outlet (Seating unavailable)","Y","Y","The Station Public toilets are located down the stairs, opposite platform 11. Accessible toilets and baby changing facilities are available adjacent to platform 10.","Y",,"N","Y","CardsAndCoins","&lt;p&gt;Find WiFi Hotspots around London Liverpool Street station&lt;/p&gt;","Y",,"N","Y","Outside the station","Y",,"Y","Located on concourse","Y","Wide range of shops","Y",,"0800 028 28 78",,"Open during station opening hours.",,"Y","Y",,"Y",,"Y","Y","<p>Taxi rank adjacent to Platform 10</p>",,,"Y","<p>Adjacent to Platform 10</p>","<p>There are lifts and escalators available.</p>","Y",,,"<p>Please ask at the Network Rail Station Reception, adjacent to Platform 10 for mobility assistance. You can also telephone to book in advance on 020 7295 2789 (Monday - Friday 0700-1900) or 07788 924 382.</p>","Y",,"Y",300,"Yes","Y",,"<p><br/></p>","Stands","<p>Replacement transport stop on either Liverpool Street (outside the station entrance), or beside Platform 10, depending on operational requirements</p>",,"<p>Taxis are available at the rank along platform 10 (during station opening hours) and outside the station entrance (during station closing hours).</p>","<p>Bus deck accessible via lift on main concourse.</p>","<p>Liverpool Street underground station has connections to the Central, Circle, Hammersmith & City and Metropolitan lines.</p>","<p>Train services run direct to Stansted airport www.stanstedexpress.com  </p>","<p>Train services available to Harwich International</p>",,,,"NR",,"DFB42226CDF94643843492B5C2517F6E"
"PAD","London Paddington","cplewa","21/11/2013",308700,"LONDON PADDINGTN","Praed Street","London","Greater London",,,"W2 1HQ",-0.176844743,51.51645141,"NR","fullTime","Y",,,"DepartureScreens, Announcements, ArrivalScreens",,"Y",,"Y",,"TicketMachine","Y","N","Y","TicketMachine","Y",,"N","N","NotAvailable","N",,"Zone 1","Applicable Operators: First Great Western","GW",,"Y","Customer services are available at this station",,"0207 262 0344",,"http://www.left-baggage.co.uk/locations.php","Y","Excess Baggage Company",,,,"http://www.lostproperty.org/locations.php",,"Y","Excess Baggage Company","<p><strong>Located</strong></p> <p>Platform 1</p> <p><strong>Tickets Accepted</strong></p> <p>All First Class</p> <p> </p> <p><strong>Facilities</strong></p> <p>The First Class lounge offers the choice of a modern, comfortable bar area or the traditional, Victorian feel lounge.</p> <p> </p> <p>The modern extension has armchairs and tables with a bar offering complimentary refreshments. It also has workstations with access to the Internet.</p> <p>There is a large screen TVs showing Sky News and also a departures board showing train times.</p> <p>The Victorian lounge offers old world splendour and comfort, with large armchairs and soft lighting, making it the perfect area to relax.</p> <p> </p> <p>There is also a pre-bookable conference room which can seat up to eight people. Call 0207 313 1109 for more information.</p> <p><strong>Refreshments</strong></p> <p>Bar offering complimentary refreshments</p> <p><strong>Wi-Fi </strong></p> <p>Available</p> <p><strong>Showers</strong></p> <p>Available</p> <p><strong>Concessions for Standard Class sleeper customers</strong></p> <p>Yes</p> <p> </p>",,"Y","N",,,"Y",,"Y","Coffee shop Buffet Coffee kiosk Public House/Bar Food outlet (Seating available) Food outlet (Seating unavailable)","Y","Y","Accessible toilets: Changing Places facility on Platform 12","Y",,"Y","Y","CardsAndCoins","&lt;p&gt;Find WiFi Hotspots around London Paddington station&lt;/p&gt;","Y",,"Y","N","Located on the concourse","N",,"Y","Located on concourse","N","News agent Flower stall Shoe repairer Wide range of shops Mini supermarket Pharmacy Convenience store High street shops Off Licence Passport Photo Booth","Y",,"0800 1971329",,"Assistance is available to and from platforms. Please contact customer services of the appropriate train operator, 48 hours in advance: First Great Western - 0800 197 1329 Heathrow Express - 0208 750 6673",,"Y","Y",,"Y",,"Y","Y","<span style=""""font: 12px/17.01px Arial, Helvetica, sans-serif; text-align: left; text-transform: none; text-indent: 0px; letter-spacing: normal; word-spacing: 0px; float: none; display: inline !important; white-space: normal; font-size-adjust: none; font-stretch: normal; -webkit-text-stroke-width: 0px;"""">Taxi rank situated outside the station above Platform 12</span>","<p>Main Concourse</p>",,"N",,"<p>Suitable for disabled passengers. Lifts or Level access to all platforms. </p>","Y","Wide access gates available","Y",,"Y",,"Y",250,"Yes","Y","Platform 9","<span style=""""font: 12px/17.01px Arial, Helvetica, sans-serif; text-align: left; text-transform: none; text-indent: 0px; letter-spacing: normal; word-spacing: 0px; float: none; display: inline !important; white-space: normal; font-size-adjust: none; font-stretch: normal; -webkit-text-stroke-width: 0px;"""">New Cycle Racks installed January 2013</span>","Stands",,,"<p>The taxi deck is now situated above Plat 12 and is accessed via the concourse and platform 12, then by the new escalators and passenger lifts to the upper level for a new covered taxi rank.</p>","<p>Yes</p>","<p>Tube Lines.</p>","<p>Heathrow Express service from Plat 6/7, Heathrow Connect service from Plat 12.</p>",,,,"<span style=""""font: 12px/17.01px Arial, Helvetica, sans-serif; text-align: left; text-transform: none; text-indent: 0px; letter-spacing: normal; word-spacing: 0px; float: none; display: inline !important; white-space: normal; font-size-adjust: none; font-stretch: normal; -webkit-text-stroke-width: 0px;"""">If you have arranged&#160;assisted travel&#160;and are travelling from this station then please go to the Network Rail reception office, located&#160;on Platform 1, to&#160;obtain the&#160;booked assistance.&#160;</span>&#160;","NR",,"A61F069815E341639514B3985BECABFC"
"STP","London St Pancras International","Unknown","13/01/2014",155500,"St Pancras Dom","Pancras Road","London","Greater London",,,"N1C 4QP",-0.125527439,51.53062434,"NR","fullTime","Y",,,"DepartureScreens, Announcements, ArrivalScreens",,"N","Note: Only Travelcards routed 'Plus High Speed' or ''Any Permitted + HS' are val","Y","<p>On the station concourse</p>","TicketMachine","Y","Y","Y","TicketMachine","Y","Oyster pay as you go and Travelcards on Oyster are NOT available on Southeastern high speed services. Oyster transactions are only available from the First Capital Connect ticket office or from self service ticket machines operated by First Capital Connect and Southeastern","N","N","NotAvailable","N",,"Zone 1",,,,"Y","<p>Platforms 1-4 and 11-13, along with the domestic departures areas are managed by High Speed 1 (London and Continental Stations).</p> <p>Platforms 5-10 and the international departures areas are managed by Eurostar.</p> <p>Platforms A and B and the areas on the low level part of St Pancras, are managed by Network Rail.</p>",,"0207 833 1596",,"http://www.left-baggage.co.uk/locations.php","Y","Excess Baggage Company",,,,,,"Y","Excess Baggage Company","<p><strong>Located</strong></p> <p>On the same level as the platforms down from the champagne bar</p> <p><strong>Tickets Accepted</strong></p> <p>All First Class ticket holders with the exception of First Class Advance</p> <p><strong>Facilities</strong></p> <p>Screens with updated train information & also Sky News</p> <p><strong>Refreshments</strong></p> <p>Screens with updated train information & also Sky News</p> <p><strong>Wi-Fi</strong></p> <p>Yes</p> <p><strong>Showers</strong></p> <p>No</p>",,"Y","N",,,"N",,"Y",,"Y","Y",,"Y",,"N","Y","CardsAndCoins","&lt;p&gt;&lt;a href=&quot;&quot;http://btopenzone.hotspot-directory.com/results.php?txtQuick=NW1 2QP&amp;z=9&amp;radRoaming=1&quot;&quot; target=&quot;&quot;_blank&quot;&quot;&gt;Find WiFi Hotspots around London St Pancras Domestic station&lt;/a&gt;&lt;/p&gt;","N",,"N","N",,"N",,"Y",,"Y",,"Y",,,,"Available for First Capital Connect and East Midlands",,"Y","Y","<p>yes</p>","Y",,"Y","Y",,,,"N","<p>Toilet attendants are available.</p>","<p>The station entrances are located at street level and provide level access to the lower concourse. There are three lifts on the main concourse to take passengers to and from the upper level UK train platforms and the Rendezvous.</p>","Y",,,"<p>A clearly marked passenger drop off zone is located on Pancras Road which runs parallel to St Pancras International Station.</p> <p>The drop off zone leads directly to the Eurostar departures.  </p>","Y",,"Y",0,"Yes","Y","To the rear of the ground and first level of the car park.","<p><br/></p>",,,,"<p><strong>Midland Road</strong>: Currently the taxi pick up is located next to First Capital Connect station entrance. Soon a large covered queuing area will be available halfway along the lower concourse where passengers can wait for marshalled taxis.</p> <p><strong>Pancras Road</strong>: There are two taxi drop off areas in Pancras Road. One is situated halfway along the old Victorian brick built Barlow shed and is convenient for Eurostar passengers. The second is situated close to the main entrance in the new part of the station and is suitable for passengers travelling within the UK .</p>","<p><br/></p>","<p>The underground station Kings Cross St Pancras leads directly into St Pancras International and is better connected than any other London station with 6 of the major tube lines running through it - Victoria, Hammersmith and City, Piccadilly, Circle Metropolitan line and Northern. Please refer to <a href=""""http://www.tfl.gov.uk/"""" title=""""TFL"""" target=""""_blank"""">Transport for London</a> for journey times.</p>","<p><strong>Heathrow Airport</strong>: There is a direct journey to Heathrow Airport, using the Piccadilly Line. Journey time is under an hour.</p> <p>The quickest transfer from St Pancras to Heathrow Airport is to catch the Heathrow Express from London Paddington to Heathrow Airport.</p> <p><strong>Gatwick Airport</strong>: St Pancras offers a direct route from St Pancras to Gatwick Airport from Platform A.</p> <p><strong>Stansted Airport</strong>: The fastest option is to take Victoria Line to Tottenham Hale and change for the Stansted Express train. Journey time, approximately one hour.</p> <p><strong>Luton Airport</strong>: A direct train service operates from St Pancras to Luton Airport Parkway several times an hour.</p>",,,,"<p>This station is available for Eurostar services.</p> <p>Southeastern now operate high speed services to/from this station.</p> <p>If travelling to/from Stratford International station please note there is now a step free route between that station and Stratford Regional station through the new Westfield Shopping Centre, which takes about 10 minutes. There is no longer any bus link to/from Stratford Regional station. </p>","NR",,"CB172209B53D4C64AC47BC2E08CD724D"
